app_lang_sign	en	pl	de	es	pt	fr	it	tr	id	th	ja	ko	zh
app_help_02_details	You will hear an audio notifications when there are changes in charge level, battery health and connected charger. You can activate or deactivate selected notifications, edit the content or select the notification\'s sound. For charge level notifications you can specify in detail the upper and lower limits when charging and discharging phone. You can also use continuous notification about charge changes, then you will be informed about each change in the charge level from 0 to 100, or in any other given range.	Powiadomienia dźwiękowe usłyszysz przy zmianach poziomu naładowania, zdrowia baterii oraz podłączonej ładowarki. Możesz aktywować lub wyłączyć wybrane powiadomienia, edytować treść oraz wybrać dźwięk powiadomienia. Dla powiadomień o poziomie naładowania możesz szczegółowo określić granicę górną i dolną przy ładowaniu i rozładowywaniu telefonu. Moźesz również używać powiadamiania ciągłego o zmianach naładowania, wtedy będziesz informowany o każdej zmianie poziomu naładowania od 0 do 100, czy w dowolnym innym podanym zakresie.	Sie hören eine akustische Benachrichtigung, wenn sich der Ladezustand, der Akkuzustand und das angeschlossene Ladegerät ändern. Sie können ausgewählte Benachrichtigungen aktivieren oder deaktivieren, den Inhalt bearbeiten oder den Ton der Benachrichtigung auswählen. Für Ladezustandsbenachrichtigungen können Sie die Ober- und Untergrenzen beim Laden und Entladen des Telefons detailliert festlegen. Alternativ können Sie sich auch dauerhaft über Ladestandänderungen benachrichtigen lassen, dann werden Sie über jede Veränderung des Ladestands von 0 bis 100 oder in jedem anderen vorgegebenen Bereich informiert.	Escuchará notificaciones de audio cuando haya cambios en el nivel de carga, el estado de la batería y el cargador conectado. Puede activar o desactivar notificaciones seleccionadas, editar el contenido o seleccionar el sonido de la notificación. Para notificaciones de nivel de carga, puede especificar en detalle los límites superior e inferior al cargar y descargar el teléfono. También puede utilizar la notificación continua sobre cambios de carga, luego se le informará sobre cada cambio en el nivel de carga de 0 a 100, o en cualquier otro rango determinado.	Você ouvirá notificações de áudio quando houver alterações no nível de carga, na integridade da bateria e no carregador conectado. Você pode ativar ou desativar notificações selecionadas, editar o conteúdo ou selecionar o som da notificação. Para notificações de nível de carga, você pode especificar detalhadamente os limites superior e inferior ao carregar e descarregar o telefone. Você também pode usar a notificação contínua sobre alterações de cobrança, então você será informado sobre cada alteração no nível de cobrança de 0 a 100, ou em qualquer outra faixa.	Vous entendrez une notification audio en cas de changement dans le niveau de charge, l\'état de la batterie et le chargeur connecté. Vous pouvez activer ou désactiver les notifications sélectionnées, modifier le contenu ou sélectionner le son de la notification. Pour les notifications de niveau de charge, vous pouvez spécifier en détail les limites supérieure et inférieure lors du chargement et du déchargement du téléphone. Vous pouvez également utiliser une notification continue sur les changements de charge, vous serez alors informé de chaque changement du niveau de charge de 0 à 100, ou dans toute autre plage donnée.	Sentirai una notifica audio quando si verificano cambiamenti nel livello di carica, nello stato della batteria e nel caricabatterie collegato. Puoi attivare o disattivare le notifiche selezionate, modificare il contenuto o selezionare il suono della notifica. Per le notifiche del livello di carica è possibile specificare in dettaglio i limiti superiore e inferiore durante la ricarica e lo scaricamento del telefono. Puoi anche utilizzare la notifica continua sui cambiamenti di addebito, quindi sarai informato su ogni cambiamento nel livello di addebito da 0 a 100, o in qualsiasi altro intervallo specificato.	Şarj seviyesinde, pil sağlığında ve bağlı şarj cihazında değişiklik olduğunda sesli bildirim duyacaksınız. Seçilen bildirimleri etkinleştirebilir veya devre dışı bırakabilir, içeriği düzenleyebilir veya bildirimin sesini seçebilirsiniz. Şarj seviyesi bildirimleri için telefonunuzu şarj ve deşarj ederken üst ve alt limitleri detaylı olarak belirleyebilirsiniz. Ayrıca şarj değişiklikleriyle ilgili sürekli bildirimi de kullanabilirsiniz; ardından şarj seviyesindeki 0\'dan 100\'e veya herhangi bir aralıktaki her değişiklik hakkında bilgilendirileceksiniz.	Anda akan mendengar notifikasi audio ketika ada perubahan tingkat pengisian daya, kesehatan baterai, dan pengisi daya yang terhubung. Anda dapat mengaktifkan atau menonaktifkan notifikasi yang dipilih, mengedit konten, atau memilih suara notifikasi. Untuk pemberitahuan tingkat pengisian daya, Anda dapat menentukan secara detail batas atas dan bawah saat mengisi daya dan mengosongkan daya ponsel. Anda juga dapat menggunakan pemberitahuan berkelanjutan tentang perubahan biaya, lalu Anda akan diberi tahu tentang setiap perubahan tingkat tagihan dari 0 hingga 100, atau dalam rentang tertentu lainnya.	คุณจะได้ยินการแจ้งเตือนด้วยเสียงเมื่อมีการเปลี่ยนแปลงระดับการชาร์จ ความสมบูรณ์ของแบตเตอรี่ และที่ชาร์จที่เชื่อมต่ออยู่ คุณสามารถเปิดหรือปิดการแจ้งเตือนที่เลือก แก้ไขเนื้อหา หรือเลือกเสียงการแจ้งเตือนได้ สำหรับการแจ้งเตือนระดับการชาร์จ คุณสามารถระบุรายละเอียดขีดจำกัดบนและล่างเมื่อชาร์จและคายประจุโทรศัพท์ คุณยังสามารถใช้การแจ้งเตือนอย่างต่อเนื่องเกี่ยวกับการเปลี่ยนแปลงค่าธรรมเนียม จากนั้นคุณจะได้รับแจ้งเกี่ยวกับการเปลี่ยนแปลงแต่ละครั้งในระดับการชาร์จตั้งแต่ 0 ถึง 100 หรือในช่วงอื่นใดที่กำหนด	充電レベル、バッテリーの状態、接続されている充電器に変化があると、音声通知が聞こえます。選択した通知を有効または無効にしたり、コンテンツを編集したり、通知の音を選択したりできます。充電レベル通知では、携帯電話を充電および放電するときの上限と下限を詳細に指定できます。充電の変化に関する継続的な通知を使用することもできます。その場合、充電レベルが 0 から 100 まで、または他の指定された範囲内で変化するたびに通知されます。	충전 수준, 배터리 상태 및 연결된 충전기에 변화가 있으면 오디오 알림을 듣게 됩니다. 선택한 알림을 활성화 또는 비활성화하고, 콘텐츠를 편집하거나, 알림 소리를 선택할 수 있습니다. 충전 수준 알림의 경우 휴대폰 충전 및 방전 시 상한 및 하한을 자세히 지정할 수 있습니다. 또한 요금 변경에 대한 지속적인 알림을 사용할 수 있으며, 그러면 0에서 100까지 또는 기타 특정 범위에서 요금 수준의 각 변경 사항에 대한 알림을 받게 됩니다.	当电量、电池健康状况和连接的充电器发生变化时，您将听到音频通知。您可以激活或停用选定的通知、编辑内容或选择通知的声音。对于电量通知，您可以详细指定手机充电和放电时的上限和下限。您还可以使用有关费用变化的连续通知，然后您将收到有关费用级别从 0 到 100 或任何其他给定范围内的每次变化的通知。
app_help_03_title	Battery display mode	Tryb wyświetlania baterii	Batterieanzeigemodus	Modo de visualización de la batería	Modo de exibição da bateria	Mode d\'affichage de la batterie	Modalità di visualizzazione della batteria	Pil görüntüleme modu	Mode tampilan baterai	โหมดแสดงแบตเตอรี่	バッテリー表示モード	배터리 표시 모드	电池显示模式
app_help_03_details	You can switch the battery display mode between clean battery view, detailed numerical parameters for those who likes numbers, or battery with animated face. You can touch parts of the battery to read displayed information aloud. In parameters you can customize average, maximum and minimum values presentation.	Możesz przełączać tryb wyświetlania baterii pomiędzy widokiem czystej baterii, szczegółowych parametrów liczbowych dla tych którzy lubią liczby lub widokiem animowanej twarzy. Możesz dotykać części baterii aby odczytać treść pokazywanych informacji na głos. W parametrach możesz dostosować prezentowanie wartości średnich, maksymalnych i minimalnych.	Sie können den Batterieanzeigemodus zwischen sauberer Batterieansicht, detaillierten numerischen Parametern für diejenigen, die Zahlen mögen, oder Batterie mit animiertem Gesicht umschalten. Sie können Teile des Akkus berühren, um die angezeigten Informationen vorzulesen. In den Parametern können Sie die Darstellung der Durchschnitts-, Maximal- und Minimalwerte anpassen.	Puede cambiar el modo de visualización de la batería entre vista de batería limpia, parámetros numéricos detallados para quienes gustan de los números o batería con cara animada. Puede tocar partes de la batería para leer en voz alta la información que se muestra. En los parámetros puede personalizar la presentación de los valores promedio, máximo y mínimo.	Você pode alternar o modo de exibição da bateria entre visualização de bateria limpa, parâmetros numéricos detalhados para quem gosta de números ou bateria com rosto animado. Você pode tocar em partes da bateria para ler as informações exibidas em voz alta. Nos parâmetros você pode personalizar a apresentação dos valores médios, máximos e mínimos.	Vous pouvez basculer le mode d\'affichage de la batterie entre une vue claire de la batterie, des paramètres numériques détaillés pour ceux qui aiment les chiffres ou une batterie avec visage animé. Vous pouvez toucher des parties de la batterie pour lire à voix haute les informations affichées. Dans les paramètres, vous pouvez personnaliser la présentation des valeurs moyennes, maximales et minimales.	È possibile cambiare la modalità di visualizzazione della batteria tra visualizzazione pulita della batteria, parametri numerici dettagliati per chi ama i numeri o batteria con volto animato. È possibile toccare le parti della batteria per leggere ad alta voce le informazioni visualizzate. Nei parametri è possibile personalizzare la presentazione dei valori medi, massimi e minimi.	Pil görüntüleme modunu, temiz pil görünümü, sayıları sevenler için ayrıntılı sayısal parametreler veya animasyonlu yüz içeren pil arasında değiştirebilirsiniz. Görüntülenen bilgileri yüksek sesle okumak için pilin bazı kısımlarına dokunabilirsiniz. Parametrelerde ortalama, maksimum ve minimum değerlerin sunumunu özelleştirebilirsiniz.	Anda dapat mengganti mode tampilan baterai antara tampilan baterai bersih, parameter numerik terperinci bagi mereka yang menyukai angka, atau baterai dengan wajah animasi. Anda dapat menyentuh bagian baterai untuk membaca informasi yang ditampilkan dengan lantang. Dalam parameter Anda dapat menyesuaikan presentasi nilai rata-rata, maksimum dan minimum.	คุณสามารถสลับโหมดการแสดงผลแบตเตอรี่ระหว่างมุมมองแบตเตอรี่ที่สะอาด พารามิเตอร์ตัวเลขโดยละเอียดสำหรับผู้ที่ชอบตัวเลข หรือแบตเตอรี่ที่มีใบหน้าเคลื่อนไหว คุณสามารถสัมผัสส่วนต่างๆ ของแบตเตอรี่เพื่ออ่านข้อมูลที่แสดงออกมาดังๆ ในพารามิเตอร์ คุณสามารถปรับแต่งการนำเสนอค่าเฉลี่ย สูงสุด และต่ำสุดได้	バッテリー表示モードを、クリーンなバッテリー表示、数字が好きな人のための詳細な数値パラメータ、またはアニメーション化された顔付きバッテリーの間で切り替えることができます。バッテリーの部分に触れると、表示された情報を読み上げることができます。パラメータでは、平均値、最大値、最小値の表示をカスタマイズできます。	깨끗한 배터리 보기, 숫자를 좋아하는 사람들을 위한 자세한 숫자 매개변수 또는 애니메이션 얼굴이 있는 배터리 간에 배터리 표시 모드를 전환할 수 있습니다. 배터리의 일부를 터치하면 표시된 정보를 소리내어 읽을 수 있습니다. 매개변수에서 평균, 최대값, 최소값 표시를 사용자 정의할 수 있습니다.	您可以在干净的电池视图、喜欢数字的人的详细数字参数或带有动画面孔的电池之间切换电池显示模式。您可以触摸电池的某些部分来朗读显示的信息。在参数中，您可以自定义平均值、最大值和最小值的显示。
app_help_04_title	Speech settings	Ustawienia mowy	Spracheinstellungen	Configuración de voz	Configurações de fala	Paramètres de parole	Impostazioni vocali	Konuşma ayarları	Pengaturan ucapan	การตั้งค่าคำพูด	音声設定	음성 설정	语音设置
app_help_04_details	You can adjust speech playback settings, select male or female voice, and modify the speed and pitch of the voice. Remember that if you change the voice language to a different language than the application language, you will have to provide your own notifications content in the selected language. You can download selected voices to your phone, to limit the use of your network connection.	Możesz dostosować ustawienia odtwarzania głosu, wybrać głos męski lub damski, oraz zmodyfikować szybkość i wysokość głosu. Pamiętaj że jeśli zmienisz język głosu na inny niż język aplikacji, będziesz musiał podać włąsną treść powiadomień w wybranym języku. Możesz pobrać wybrane głosy na telefon, aby ograniczyć korzystanie z połączenia sieciowego.	Sie können die Einstellungen für die Sprachwiedergabe anpassen, eine männliche oder weibliche Stimme auswählen und die Geschwindigkeit und Tonhöhe der Stimme ändern. Denken Sie daran, dass Sie Ihren eigenen Benachrichtigungsinhalt in der ausgewählten Sprache bereitstellen müssen, wenn Sie die Sprachsprache auf eine andere als die Anwendungssprache ändern. Sie können ausgewählte Stimmen auf Ihr Telefon herunterladen, um die Nutzung Ihrer Netzwerkverbindung einzuschränken.	Puede ajustar la configuración de reproducción de voz, seleccionar voz masculina o femenina y modificar la velocidad y el tono de la voz. Recuerda que si cambias el idioma de la voz a un idioma diferente al de la aplicación, tendrás que proporcionar tu propio contenido de notificaciones en el idioma seleccionado. Puede descargar voces seleccionadas a su teléfono para limitar el uso de su conexión de red.	Você pode ajustar as configurações de reprodução de fala, selecionar voz masculina ou feminina e modificar a velocidade e o tom da voz. Lembre-se de que se você alterar o idioma da voz para um idioma diferente do idioma do aplicativo, você terá que fornecer seu próprio conteúdo de notificações no idioma selecionado. Você pode baixar vozes selecionadas para o seu telefone, para limitar o uso da sua conexão de rede.	Vous pouvez ajuster les paramètres de lecture vocale, sélectionner une voix masculine ou féminine et modifier la vitesse et la hauteur de la voix. N\'oubliez pas que si vous modifiez la langue de la voix dans une langue différente de celle de l\'application, vous devrez fournir votre propre contenu de notifications dans la langue sélectionnée. Vous pouvez télécharger les voix sélectionnées sur votre téléphone pour limiter l\'utilisation de votre connexion réseau.	Puoi regolare le impostazioni di riproduzione vocale, selezionare la voce maschile o femminile e modificare la velocità e il tono della voce. Ricorda che se cambi la lingua della voce in una lingua diversa da quella dell\'applicazione, dovrai fornire il contenuto delle notifiche nella lingua selezionata. È possibile scaricare voci selezionate sul telefono per limitare l\'uso della connessione di rete.	Konuşma çalma ayarlarını yapabilir, erkek veya kadın sesini seçebilir ve sesin hızını ve perdesini değiştirebilirsiniz. Ses dilini uygulama dilinden farklı bir dile değiştirirseniz, seçilen dilde kendi bildirim içeriğinizi sağlamanız gerekeceğini unutmayın. Ağ bağlantınızın kullanımını sınırlamak için seçilen sesleri telefonunuza indirebilirsiniz.	Anda dapat menyesuaikan pengaturan pemutaran ucapan, memilih suara pria atau wanita, dan mengubah kecepatan dan nada suara. Ingatlah bahwa jika Anda mengubah bahasa suara ke bahasa yang berbeda dari bahasa aplikasi, Anda harus menyediakan konten notifikasi Anda sendiri dalam bahasa yang dipilih. Anda dapat mendownload suara yang dipilih ke telepon Anda, untuk membatasi penggunaan koneksi jaringan Anda.	คุณสามารถปรับการตั้งค่าการเล่นเสียงพูด เลือกเสียงชายหรือหญิง และปรับเปลี่ยนความเร็วและระดับเสียงได้ โปรดจำไว้ว่าหากคุณเปลี่ยนภาษาเสียงเป็นภาษาอื่นที่ไม่ใช่ภาษาของแอปพลิเคชัน คุณจะต้องจัดเตรียมเนื้อหาการแจ้งเตือนของคุณเองในภาษาที่เลือก คุณสามารถดาวน์โหลดเสียงที่เลือกลงในโทรศัพท์ของคุณ เพื่อจำกัดการใช้การเชื่อมต่อเครือข่ายของคุณ	音声の再生設定を調整したり、男性または女性の声を選択したり、声の速度やピッチを変更したりできます。音声言語をアプリケーション言語とは異なる言語に変更する場合は、選択した言語で独自の通知コンテンツを提供する必要があることに注意してください。選択した音声を携帯電話にダウンロードして、ネットワーク接続の使用を制限できます。	음성 재생 설정을 조정하고, 남성 또는 여성 음성을 선택하고, 음성의 속도와 피치를 수정할 수 있습니다. 음성 언어를 애플리케이션 언어와 다른 언어로 변경하는 경우 선택한 언어로 알림 콘텐츠를 직접 제공해야 한다는 점을 기억하세요. 선택한 음성을 휴대폰에 다운로드하여 네트워크 연결 사용을 제한할 수 있습니다.	您可以调整语音播放设置，选择男声或女声，并修改语音的速度和音调。请记住，如果您将语音语言更改为与应用程序语言不同的语言，则必须以所选语言提供您自己的通知内容。您可以将选定的声音下载到您的手机，以限制您的网络连接的使用。
app_help_05_title	Notifications settings	Ustawienia powiadomień	Benachrichtigungseinstellungen	Configuracion de notificaciones	Configurações de notificações	Paramètres des notifications	Impostazioni delle notifiche	Bildirim ayarları	Pengaturan notifikasi	การตั้งค่าการแจ้งเตือน	通知設定	알림 설정	通知设置
