app_lang_sign	en	pl	de	es	pt	fr	it	tr	id	th	ja	ko	zh	ar	ru	uk	vi	hi	bn	ur	ms	sw	he	el	nl	sv	ro	hu	cs	sk	sr	bg
tips_title_02	Turn off unused connections	Wyłączaj nieużywane połączenia	Nicht verwendete Verbindungen deaktivieren	Desactivar las conexiones que no uses	Desligue as ligações não utilizadas	Désactivez les connexions inutilisées	Disattiva le connessioni inutilizzate	Kullanılmayan bağlantıları kapatın	Matikan koneksi yang tidak digunakan	ปิดการเชื่อมต่อที่ไม่ได้ใช้	未使用の接続をオフにする	사용하지 않는 연결 끄기	关闭未使用的连接	قم بإيقاف تشغيل الاتصالات غير المستخدمة	Отключите неиспользуемые подключения	Вимкніть невикористовувані підключення	Tắt các kết nối không sử dụng	अप्रयुक्त कनेक्शन बंद करें	অব্যবহৃত সংযোগগুলি বন্ধ করুন	غیر استعمال شدہ کنکشن بند کر دیں۔	Matikan sambungan yang tidak digunakan	Zima muunganisho usiotumika	כבה חיבורים שאינם בשימוש	Απενεργοποιήστε τις αχρησιμοποίητες συνδέσεις	Schakel ongebruikte verbindingen uit	Stäng av oanvända anslutningar	Dezactivează conexiunile neutilizate	Kapcsold ki a nem használt kapcsolatokat	Vypněte nepoužívaná připojení	Vypnite nepoužívané pripojenia	Isključite nekorišćene veze	Изключи неизползваните връзки
tips_text_02_01	Consider temporarily disabling external connections if they are not in use or needed.	Rozważ tymczasowe wyłączenie połączeń zewnętrznych, jeśli nie są używane i potrzebne.	Ziehen Sie in Erwägung, externe Verbindungen vorübergehend zu deaktivieren, wenn sie nicht verwendet oder benötigt werden.	Considerar la posibilidad de desactivar temporalmente las conexiones externas si no se utilizan o no son necesarias.	Considere desativar temporariamente as ligações externas se não estiverem a ser utilizadas ou não forem necessárias.	Envisagez de désactiver temporairement les connexions externes si elles ne sont pas utilisées ou nécessaires.	Valuta di disabilitare temporaneamente le connessioni esterne se non sono in uso o non sono necessarie.	Kullanılmıyorsa veya ihtiyaç duyulmuyorsa harici bağlantıları geçici olarak devre dışı bırakmayı düşünün.	Pertimbangkan untuk menonaktifkan sementara koneksi eksternal jika tidak digunakan atau dibutuhkan.	พิจารณาปิดการเชื่อมต่อภายนอกชั่วคราวหากไม่ได้ใช้งานหรือไม่จำเป็น	使用していない、または必要ない場合は、外部接続を一時的に無効にすることを検討してください。	사용하지 않거나 필요하지 않은 경우 외부 연결을 일시적으로 비활성화하는 것을 고려하세요.	如果未使用或不需要外部连接，请考虑暂时禁用它们。	فكر في تعطيل الاتصالات الخارجية مؤقتًا إذا لم تكن قيد الاستخدام أو مطلوبة.	Рассмотрите возможность временного отключения внешних подключений, если они не используются или не нужны.	Подумайте про тимчасове відключення зовнішніх підключень, якщо вони не використовуються або не потрібні.	Cân nhắc tạm thời tắt các kết nối bên ngoài nếu chúng không được sử dụng hoặc không cần thiết.	यदि वे उपयोग में नहीं हैं या उनकी ज़रूरत नहीं है, तो बाहरी कनेक्शन को अस्थायी रूप से अक्षम करने पर विचार करें।	বাহ্যিক সংযোগগুলি ব্যবহার বা প্রয়োজনে না থাকলে সাময়িকভাবে অক্ষম করার কথা বিবেচনা করুন৷	اگر بیرونی کنکشن استعمال میں نہیں ہیں یا ضرورت نہیں ہیں تو انہیں عارضی طور پر غیر فعال کرنے پر غور کریں۔	Pertimbangkan untuk mematikan sementara sambungan luaran jika ia tidak digunakan atau diperlukan.	Fikiria kuzima kwa muda muunganisho wa nje ikiwa hautumiki au hauhitajiki.	שקול להשבית זמנית חיבורים חיצוניים אם הם אינם בשימוש או נחוצים.	Εξετάστε το ενδεχόμενο να απενεργοποιήσετε προσωρινά τις εξωτερικές συνδέσεις εάν δεν χρησιμοποιούνται ή δεν χρειάζονται.	Overweeg om externe verbindingen tijdelijk uit te schakelen als ze niet in gebruik zijn of niet nodig zijn.	Överväg att tillfälligt inaktivera externa anslutningar om de inte används eller behövs.	Ia în considerare dezactivarea temporară a conexiunilor externe dacă nu sunt utilizate sau necesare.	Fontold meg a külső kapcsolatok ideiglenes letiltását, ha nincsenek használatban vagy nincs rájuk szükség.	Zvažte dočasné zakázání externích připojení, pokud se nepoužívají nebo nejsou potřeba.	Zvážte dočasné zakázanie externých pripojení, ak sa nepoužívajú alebo nie sú potrebné.	Razmotrite privremeno onemogućavanje spoljnih veza ako se ne koriste ili nisu potrebne.	Обмисли временно деактивиране на външни връзки, ако не се използват или не са необходими.
tips_text_02_02	If enabled, they will try to restore broken connections, search for new available connections,	Włączone będą próbowały przywracać zerwane połączenia, poszukiwać nowych dostępnych połączeń,	Wenn sie aktiviert sind, versuchen sie, unterbrochene Verbindungen wiederherzustellen, nach neuen verfügbaren Verbindungen zu suchen,	Si se habilitan, intentarán restaurar las conexiones rotas, buscar nuevas conexiones disponibles,	Se estiver ativado, tentarão restaurar as ligações interrompidas, procurar novas ligações disponíveis,	Si elles sont activées, elles essaieront de restaurer les connexions interrompues, de rechercher de nouvelles connexions disponibles,	Se abilitate, proveranno a ripristinare le connessioni interrotte, cercheranno nuove connessioni disponibili,	Etkinleştirilirlerse, kopan bağlantıları geri yüklemeye, yeni kullanılabilir bağlantılar aramaya,	Jika diaktifkan, koneksi tersebut akan mencoba memulihkan koneksi yang rusak, mencari koneksi baru yang tersedia,	หากเปิดใช้งาน วิดเจ็ตจะพยายามกู้คืนการเชื่อมต่อที่ขาดหาย ค้นหาการเชื่อมต่อใหม่ที่พร้อมใช้งาน	有効にすると、切断された接続を復元したり、新しい利用可能な接続を検索したり、現在のデータをダウンロードしたりするため、バッテリーが消耗します。	활성화하면 끊어진 연결을 복구하고, 사용 가능한 새 연결을 검색하고,	如果启用，它们将尝试恢复断开的连接，搜索新的可用连接，	إذا تم تمكينها، فستحاول استعادة الاتصالات المقطوعة، والبحث عن اتصالات جديدة متاحة،	Если они включены, они попытаются восстановить разорванные соединения, найти новые доступные соединения,	Якщо ввімкнено, вони намагатимуться відновити розірвані з’єднання, шукати нові доступні з’єднання,	Nếu được bật, chúng sẽ cố gắng khôi phục các kết nối bị hỏng, tìm kiếm các kết nối mới khả dụng,	यदि सक्षम किया जाता है, तो वे टूटे हुए कनेक्शन को पुनर्स्थापित करने, नए उपलब्ध कनेक्शन की खोज करने,	সক্ষম হলে, তারা ভাঙা সংযোগগুলি পুনরুদ্ধার করার চেষ্টা করবে, নতুন উপলব্ধ সংযোগগুলি অনুসন্ধান করবে,	فعال ہونے پر، وہ ٹوٹے ہوئے کنکشنز کو بحال کرنے کی کوشش کریں گے، نئے دستیاب کنکشن تلاش کریں گے،	Jika diaktifkan, ia akan cuba memulihkan sambungan yang rosak, mencari sambungan baharu yang tersedia,	Ikiwashwa, itajaribu kurejesha muunganisho uliovunjika, kutafuta muunganisho mpya unaopatikana,	אם הם מופעלים, הם ינסו לשחזר חיבורים שבורים, לחפש חיבורים חדשים זמינים,	Εάν είναι ενεργοποιημένες, θα προσπαθήσουν να επαναφέρουν τις κατεστραμμένες συνδέσεις, να αναζητήσουν νέες διαθέσιμες συνδέσεις,	Indien ingeschakeld, zullen ze proberen verbroken verbindingen te herstellen, naar nieuwe beschikbare verbindingen zoeken,	Om de är aktiverade kommer de att försöka återställa trasiga anslutningar, söka efter nya tillgängliga anslutningar,	Dacă sunt activate, vor încerca să restabilească conexiunile întrerupte, să caute conexiuni noi disponibile,	Ha engedélyezve vannak, megpróbálják helyreállítani a megszakadt kapcsolatokat, új elérhető kapcsolatokat keresnek,	Pokud jsou povolena, budou se snažit obnovit přerušená připojení, vyhledávat nová dostupná připojení,	Ak sú povolené, pokúsia sa obnoviť prerušené pripojenia, vyhľadať nové dostupné pripojenia,	Ako su omogućene, pokušaće da vrate prekinute veze, traže nove dostupne veze,	Ако са активирани, те ще се опитат да възстановят прекъснати връзки, да търсят нови налични връзки,
tips_text_02_03	download current data, which drains the battery.	pobierać aktualne dane, co wyczerpuje baterie.	aktuelle Daten herunterzuladen, was den Akku entlädt.	descargar los datos actuales, lo que agota la batería. Estas conexiones son:	descarregar dados atuais, o que esgota a bateria.	de télécharger les données actuelles, ce qui vide la batterie.	scaricheranno i dati correnti, il che scarica la batteria. Queste connessioni sono:	geçerli verileri indirmeye çalışırlar ve bu da pili boşaltır. Bu bağlantılar şunlardır:	mengunduh data saat ini, yang menguras baterai. Koneksi ini meliputi:	ดาวน์โหลดข้อมูลปัจจุบัน ซึ่งจะทำให้แบตเตอรี่หมด การเชื่อมต่อเหล่านี้คือ:	これらの接続は次のとおりです。	현재 데이터를 다운로드하려고 시도하여 배터리가 소모됩니다.	下载当前数据，这会耗尽电池。	وتنزيل البيانات الحالية، مما يؤدي إلى استنزاف البطارية.	загрузить текущие данные, что разряжает аккумулятор.	завантажувати поточні дані, що виснажує акумулятор.	tải xuống dữ liệu hiện tại, làm cạn kiệt pin.	वर्तमान डेटा डाउनलोड करने का प्रयास करेंगे, जिससे बैटरी खत्म हो जाती है।	বর্তমান ডেটা ডাউনলোড করুন, যা ব্যাটারি নিষ্কাশন করে।	موجودہ ڈیٹا ڈاؤن لوڈ کریں، جس سے بیٹری ختم ہوجاتی ہے۔	memuat turun data semasa, yang menghabiskan bateri.	pakua data ya sasa, ambayo inaisha betri.	הורד נתונים עדכניים, מה שמרוקן את הסוללה.	λήψη τρεχόντων δεδομένων, γεγονός που εξαντλεί την μπαταρία.	huidige gegevens downloaden, wat de batterij leegtrekt.	ladda ner aktuell data, vilket dränerar batteriet.	să descarce date curente, ceea ce descarcă bateria.	aktuális adatokat töltenek le, ami lemeríti az akkumulátort.	stahovat aktuální data, což vybíjí baterii.	stiahnuť aktuálne dáta, čo vybíja batériu.	preuzmu trenutne podatke, što prazni bateriju.	да изтеглят текущи данни, което изтощава батерията.
tips_text_02_04	These connections are:	Te połączenia to:	Diese Verbindungen sind:	* Comunicación Bluetooth (se utiliza, por ejemplo, para conectar altavoces o auriculares)	Essas ligações são:	Ces connexions sont :	* Comunicazione Bluetooth (utilizzata ad esempio per collegare altoparlanti, cuffie)	* Bluetooth iletişimi (örneğin hoparlörleri, kulaklıkları bağlamak için kullanılır)	* Komunikasi Bluetooth (misalnya digunakan untuk menghubungkan speaker, headphone)	* การสื่อสารผ่านบลูทูธ (ใช้เชื่อมต่อลำโพงหรือหูฟัง)	* Bluetooth 通信 (スピーカーやヘッドフォンの接続などに使用)	이러한 연결은 다음과 같습니다.	这些连接包括：	هذه الاتصالات هي:	Вот эти соединения:	Ці зв'язки:	Các kết nối này là:	ये कनेक्शन हैं:	এই সংযোগগুলি হল:	یہ کنکشن ہیں:	Sambungan ini ialah:	Muunganisho huu ni:	חיבורים אלה הם:	Αυτές οι συνδέσεις είναι:	Deze verbindingen zijn:	Dessa anslutningar är:	Aceste conexiuni sunt:	Ezek a kapcsolatok a következők:	Tato připojení jsou:	Tieto pripojenia sú:	Ove veze su:	Тези връзки са:
tips_text_02_05	* Bluetooth communication (used for example to connect speakers, headphones)	* komunikacja Bluetooth (używana np. do podłączenia głośników, słuchawek)	* Bluetooth-Kommunikation (wird beispielsweise zum Anschließen von Lautsprechern und Kopfhörern verwendet)	* Ubicación GPS (utilizada por aplicaciones, por ejemplo, para determinar la ubicación o la dirección)	* Comunicação Bluetooth (utilizada, por exemplo, para ligar colunas, auscultadores)	* Communication Bluetooth (utilisée par exemple pour connecter des enceintes, des écouteurs)	* Posizione GPS (utilizzata dalle applicazioni, ad esempio per determinare posizione, indirizzo)	* GPS konumu (örneğin konum, adres belirlemek için uygulamalar tarafından kullanılır)	* Lokasi GPS (misalnya digunakan oleh aplikasi, misalnya untuk menentukan lokasi, alamat)	* ตำแหน่ง GPS (ใช้โดยแอปพลิเคชัน เช่น เพื่อระบุตำแหน่ง ที่อยู่)	* GPS 位置情報 (アプリケーションで使用、たとえば場所や住所の特定に使用)	* Bluetooth 통신(예: 스피커, 헤드폰 연결에 사용)	* 蓝牙通信（例如用于连接扬声器、耳机）	* اتصال Bluetooth (يستخدم على سبيل المثال لتوصيل مكبرات الصوت وسماعات الرأس)	* Связь Bluetooth (используется, например, для подключения динамиков, наушников)	* Зв'язок Bluetooth (використовується, наприклад, для підключення колонок, навушників)	* Giao tiếp Bluetooth (ví dụ dùng để kết nối loa, tai nghe)	* ब्लूटूथ संचार (उदाहरण के लिए स्पीकर, हेडफ़ोन कनेक्ट करने के लिए उपयोग किया जाता है)	* ব্লুটুথ যোগাযোগ (উদাহরণস্বরূপ স্পিকার, হেডফোন সংযোগ করতে ব্যবহৃত)	* بلوٹوتھ کمیونیکیشن (مثال کے طور پر اسپیکر، ہیڈ فون کو جوڑنے کے لیے استعمال کیا جاتا ہے)	* Komunikasi Bluetooth (digunakan contohnya untuk menyambungkan pembesar suara, fon kepala)	* Mawasiliano ya Bluetooth (inayotumika kwa mfano kuunganisha spika, vifaa vya sauti)	* תקשורת בלוטות' (משמשת למשל לחיבור רמקולים, אוזניות)	* Επικοινωνία Bluetooth (χρησιμοποιείται για παράδειγμα για τη σύνδεση ηχείων, ακουστικών)	* Bluetooth-communicatie (bijvoorbeeld gebruikt om luidsprekers, hoofdtelefoons aan te sluiten)	* Bluetooth-kommunikation (används till exempel för att ansluta högtalare, hörlurar)	* Comunicare Bluetooth (utilizată de exemplu pentru conectarea difuzoarelor, căștilor)	* Bluetooth kommunikáció (például hangszórók, fejhallgatók csatlakoztatására használatos)	* Komunikace Bluetooth (používá se například k připojení reproduktorů, sluchátek)	* Komunikácia Bluetooth (používa sa napríklad na pripojenie reproduktorov, slúchadiel)	* Bluetooth komunikacija (koristi se na primer za povezivanje zvučnika, slušalica)	* Bluetooth комуникация (използва се например за свързване на високоговорители, слушалки)
tips_text_02_06	* GPS location (used by applications, for example to determine location, address)	* lokalizacja GPS (używana przez aplikacje np. do określenia położenia, adresu)	* GPS-Standort (wird von Anwendungen verwendet, beispielsweise um Standort und Adresse zu bestimmen)	* Datos móviles y red Wi-Fi (se utilizan para conectarse a Internet y descargar datos actuales: notificaciones, correos electrónicos)	* Localização GPS (utilizada pelas aplicações, por exemplo, para determinar a localização, o endereço)	* Localisation GPS (utilisée par les applications, par exemple pour déterminer la localisation, l'adresse)	* Dati mobili e rete Wi-Fi (utilizzata per connettersi a Internet e scaricare i dati correnti, notifiche, e-mail)	* Mobil Veri ve Wi-Fi ağı (İnternete bağlanmak ve güncel verileri indirmek için kullanılır - bildirimler, e-postalar)	* Data Seluler dan jaringan Wi-Fi (digunakan untuk terhubung ke Internet dan mengunduh data terkini - notifikasi, email)	* ข้อมูลมือถือและเครือข่าย Wi-Fi (ใช้เชื่อมต่ออินเทอร์เน็ตและดาวน์โหลดข้อมูลปัจจุบัน เช่น การแจ้งเตือน อีเมล)	* モバイル データと Wi-Fi ネットワーク (インターネットに接続し、通知やメールなどの最新データをダウンロードするために使用)	* GPS 위치(예: 위치, 주소 확인에 애플리케이션에서 사용)	* GPS 定位（应用程序使用，例如用于确定位置、地址）	* موقع GPS (يستخدمه التطبيقات، على سبيل المثال لتحديد الموقع والعنوان)	* Местоположение GPS (используется приложениями, например, для определения местоположения, адреса)	* Місцезнаходження GPS (використовується програмами, наприклад, для визначення місцезнаходження, адреси)	* Vị trí GPS (ứng dụng dùng để xác định vị trí, địa chỉ)	* GPS स्थान (एप्लिकेशन द्वारा उपयोग किया जाता है, उदाहरण के लिए स्थान, पता निर्धारित करने के लिए)	* জিপিএস অবস্থান (অ্যাপ্লিকেশন দ্বারা ব্যবহৃত, উদাহরণস্বরূপ অবস্থান, ঠিকানা নির্ধারণ করতে)	* GPS مقام (ایپلی کیشنز کے ذریعے استعمال کیا جاتا ہے، مثال کے طور پر مقام، پتہ کا تعین کرنے کے لیے)	* Lokasi GPS (digunakan oleh aplikasi, contohnya untuk menentukan lokasi, alamat)	* Mahali pa GPS (inayotumiwa na programu, kwa mfano kubaini eneo, anwani)	* מיקום GPS (בשימוש על ידי יישומים, למשל כדי לקבוע מיקום, כתובת)	* Τοποθεσία GPS (χρησιμοποιείται από εφαρμογές, για παράδειγμα για τον προσδιορισμό τοποθεσίας, διεύθυνσης)	* GPS-locatie (gebruikt door applicaties, bijvoorbeeld om locatie, adres te bepalen)	* GPS-position (används av applikationer, till exempel för att bestämma plats, adress)	* Locație GPS (utilizată de aplicații, de exemplu pentru a determina locația, adresa)	* GPS helymeghatározás (alkalmazások használják, például hely, cím meghatározására)	* Poloha GPS (používá se aplikacemi, například k určení polohy, adresy)	* Poloha GPS (používa sa aplikáciami, napríklad na určenie polohy, adresy)	* GPS lokacija (koriste je aplikacije, na primer za određivanje lokacije, adrese)	* GPS местоположение (използва се от приложения, например за определяне на местоположение, адрес)
