app_lang_sign	en	pl	de	es	pt	fr	it	tr	id	th	ja	ko	zh
app_lang_en_word	english	polish	german	spanish	portuguese	french	italian	turkish	indonesian	thai	japanese	korean	chinese
app_lang_word	english	polski	deutsch	español	português	français	italiano	Türkçe	bahasa Indonesia	แบบไทย	日本語	한국인	中国人
app_name_ads	110 Talking Battery	110 Mówiąca Bateria	110 Sprechende Batterie	110 Batería Parlante	110 Bateria Falante	110 Batterie Parlante	110 Batteria Parlante	110 Konuşan Pil	110 Baterai Berbicara	110 แบตเตอรี่พูดได้	110 トーキングバッテリー	110 말하는 배터리	110 会说话的电池
app_name_plus	110 Talking Battery Plus	110 Mówiąca Bateria Plus	110 Sprechende Batterie Plus	110 Batería Parlante Plus	110 Bateria Falante Plus	110 Batterie Parlante Plus	110 Batteria Parlante Plus	110 Konuşan Pil Artı	110 Baterai Berbicara Plus	110 พูดคุยแบตเตอรี่พลัส	110 トーキングバッテリープラス	110 말하는 배터리 플러스	110 会说话的电池+
app_rights_reserved	All rights reserved	Wszystkie prawa zastrzeżone	Alle Rechte vorbehalten	Reservados todos los derechos	Todos os direitos reservados	Tous droits réservés	Tutti i diritti riservati	Her hakkı saklıdır	Seluruh hak cipta	สงวนลิขสิทธิ์	無断転載を禁じます	판권 소유	版权所有
app_notifications_word	Notifications	Powiadomienia	Benachrichtigungen	Notificaciones	Notificações	Notifications	Notifiche	Bildirimler	Pemberitahuan	การแจ้งเตือน	通知	알림	通知
app_notifications_description	Notifications about phones battery parameters	Powiadomienia o parametrach baterii telefonu	Benachrichtigungen über die Akkuparameter des Telefons	Notificaciones sobre parámetros de batería de teléfonos.	Notificações sobre parâmetros de bateria de telefones	Notifications sur les paramètres de la batterie des téléphones	Notifiche sui parametri della batteria del telefono	Telefonların pil parametreleriyle ilgili bildirimler	Pemberitahuan tentang parameter baterai ponsel	การแจ้งเตือนเกี่ยวกับพารามิเตอร์แบตเตอรี่ของโทรศัพท์	電話機のバッテリーパラメータに関する通知	휴대폰 배터리 매개변수에 대한 알림	关于手机电池参数的通知
app_about_name	Name	Nazwa	Name	Nombre	Nome	Nom	Nome	İsim	Nama	ชื่อ	名前	이름	姓名
app_about_version	Version	Wersja	Ausführung	Versión	Versão	Version	Versione	Sürüm	Versi: kapan	เวอร์ชัน	バージョン	버전	版本
app_about_producer	Producer	Producent	Hersteller	Productor	Produtor	Producteur	Produttore	Üretici	Produsen	ผู้ผลิต	プロデューサー	생산자	制片人
app_about_email	E-mail	E-mail	Email	Correo electrónico	E-mail	E-mail	E-mail	E-posta	Surel	อีเมล	E メール	이메일	电子邮件
app_about_webpage	Webpage	Strona internetowa	Website	Página web	Página da Internet	Page web	Pagina web	Web sayfası	Halaman web	หน้าเว็บ	ウェブページ	웹 페이지	网页
social_google_youtube_channel	YouTube Channel	Kanał YouTube	Youtube Kanal	Canal de Youtube	Canal do Youtube	Chaîne Youtube	Canale Youtube	Youtube kanalı	Saluran Youtube	ช่องยูทูป	YouTube チャンネル	유튜브 채널	YouTube 频道
store_google_play	Store Google Play	Sklep Google Play	Store Google Play	Tienda Google Play	Armazene o Google Play	Magasin Google Play	Memorizza Google Play	Google Play\'i saklayın	Simpan Google Play	เก็บ Google Play	Google Play ストア	Google Play 스토어	Google Play 商店
app_technical_parameters	Technical parameters	Parametry techniczne	Technische Parameter	Parámetros técnicos	Parâmetros técnicos	paramètres techniques	parametri tecnici	teknik parametreler	Parameter teknik	พารามิเตอร์ทางเทคนิค	技術的パラメータ	기술적인 매개변수	技术参数
app_email_question	Question	Pytanie	Frage	Pregunta	Pergunta	Question	Domanda	Soru	Pertanyaan	คำถาม	質問	질문	问题
app_email_client_title	Send email	Wyślij email	E-Mail senden	Enviar correo electrónico	Enviar email	Envoyer un e-mail	Invia una email	Eposta gönder	Mengirim email	ส่งอีเมล	メールを送る	이메일을 보내	发电子邮件
app_email_client_missing	No email application	Brak aplikacji do emaili	Keine E-Mail-Bewerbung	Sin solicitud de correo electrónico	Nenhum aplicativo de e-mail	Pas de candidature par courrier électronique	Nessuna applicazione di posta elettronica	E-posta uygulaması yok	Tidak ada aplikasi email	ไม่มีแอปพลิเคชันอีเมล	メールアプリはありません	이메일 신청 불가	没有电子邮件申请
help_tip_remove_ads	To remove ads, purchase full version of the application	Aby usunąć reklamy kup pełną wersję aplikacji	Um Werbung zu entfernen, erwerben Sie die Vollversion der Anwendung	Para eliminar anuncios, compre la versión completa de la aplicación.	Para remover anúncios, adquira a versão completa do aplicativo	Pour supprimer les publicités, achetez la version complète de l\'application	Per rimuovere gli annunci, acquista la versione completa dell\'applicazione	Reklamları kaldırmak için uygulamanın tam sürümünü satın alın	Untuk menghapus iklan, beli aplikasi versi lengkap	หากต้องการลบโฆษณา ให้ซื้อแอปพลิเคชันเวอร์ชันเต็ม	広告を削除するには、アプリケーションのフルバージョンを購入してください	광고를 제거하려면 애플리케이션 정식 버전을 구입하세요.	要删除广告，请购买完整版应用程序
help_tip_rating	Don\'t forget about the positive rating	Nie zapomnij o pozytywnej ocenie	Vergessen Sie nicht die positive Bewertung	No te olvides de la calificación positiva.	Não se esqueça da avaliação positiva	N\'oubliez pas la note positive	Non dimenticare la valutazione positiva	Olumlu puanı unutmayın	Jangan lupa rating positifnya	อย่าลืมเกี่ยวกับคะแนนเชิงบวก	肯定的な評価を忘れないでください	긍정적인 평가를 잊지 마세요	不要忘记积极的评价
help_tip_start_introduction	First, listen to a demonstration of the application\'s features, start with the button at the top	Na początek wysłuchaj prezentacji funkcji aplikacji, uruchom przyciskiem u góry	Hören Sie sich zunächst eine Demonstration der Funktionen der Anwendung an. Beginnen Sie mit der Schaltfläche oben	Primero, escuche una demostración de las características de la aplicación, comience con el botón en la parte superior	Primeiro, ouça uma demonstração dos recursos do aplicativo, comece pelo botão na parte superior	Tout d\'abord, écoutez une démonstration des fonctionnalités de l\'application, commencez par le bouton en haut	Per prima cosa ascolta una dimostrazione delle funzionalità dell\'applicazione, inizia con il pulsante in alto	Öncelikle uygulamanın özelliklerinin tanıtımını dinleyin, üstteki düğmeyle başlayın	Pertama, dengarkan demonstrasi fitur aplikasi, mulai dari tombol di bagian atas	ขั้นแรก ฟังการสาธิตคุณสมบัติของแอปพลิเคชัน โดยเริ่มจากปุ่มด้านบน	まず、アプリケーションの機能のデモを聞き、上部のボタンから始めます	먼저, 애플리케이션의 기능에 대한 데모를 듣고, 상단에 있는 버튼부터 시작하세요.	首先，听一下应用程序功能的演示，从顶部的按钮开始
help_tip_on_event_screen	In the parameters, you can set the battery status notification after pressing the unlock button	W parametrach możesz ustawić powiadomienie o stanie baterii po wciśnięciu przycisku odblokowania	In den Parametern können Sie die Benachrichtigung über den Batteriestatus nach Drücken der Entriegelungstaste einstellen	En los parámetros, puede configurar la notificación del estado de la batería después de presionar el botón de desbloqueo	Nos parâmetros, você pode definir a notificação do status da bateria após pressionar o botão de desbloqueio	Dans les paramètres, vous pouvez définir la notification de l\'état de la batterie après avoir appuyé sur le bouton de déverrouillage	Nei parametri è possibile impostare la notifica sullo stato della batteria dopo aver premuto il pulsante di sblocco	Parametrelerde, kilit açma düğmesine bastıktan sonra pil durumu bildirimini ayarlayabilirsiniz.	Di parameter, Anda dapat mengatur notifikasi status baterai setelah menekan tombol buka kunci	ในพารามิเตอร์ คุณสามารถตั้งค่าการแจ้งเตือนสถานะแบตเตอรี่ได้หลังจากกดปุ่มปลดล็อค	パラメータで、ロック解除ボタンを押した後のバッテリーステータス通知を設定できます	매개변수에서 잠금 해제 버튼을 누른 후 배터리 상태 알림을 설정할 수 있습니다.	在参数中可以设置按下解锁按钮后电池状态通知
help_tip_email	If you have additional questions, please send details by email	Jeśli masz dodatkowe pytania, proszę prześlij szczegóły na email	Wenn Sie weitere Fragen haben, senden Sie bitte Einzelheiten per E-Mail	Si tiene preguntas adicionales, envíe los detalles por correo electrónico.	Se você tiver dúvidas adicionais, envie detalhes por e-mail	Si vous avez des questions supplémentaires, veuillez envoyer les détails par e-mail	Se hai ulteriori domande, invia i dettagli tramite e-mail	Başka sorularınız varsa lütfen ayrıntıları e-postayla gönderin	Jika Anda memiliki pertanyaan tambahan, silakan kirim detailnya melalui email	หากคุณมีคำถามเพิ่มเติม โปรดส่งรายละเอียดทางอีเมล	さらにご質問がある場合は、電子メールで詳細をお送りください	추가 문의사항이 있으시면 이메일로 자세한 내용을 보내주세요	如果您还有其他问题，请通过电子邮件发送详细信息
title_activity_application_settings	Settings	Ustawienia	Einstellungen	Ajustes	Configurações	Paramètres	Impostazioni	Ayarlar	Pengaturan	การตั้งค่า	設定	설정	设置
title_activity_system_application_settings	System application settings	Ustawienia systemowe aplikacji	Systemanwendungseinstellungen	Configuración de la aplicación del sistema	Configurações do aplicativo do sistema	Paramètres des applications système	Impostazioni dell\'applicazione di sistema	Sistem uygulaması ayarları	Pengaturan aplikasi sistem	การตั้งค่าแอปพลิเคชันระบบ	システムアプリケーション設定	시스템 애플리케이션 설정	系统应用程序设置
title_activity_system_battery_settings	System battery settings	Ustawienia systemowe baterii	Systembatterieeinstellungen	Configuración de la batería del sistema	Configurações da bateria do sistema	Paramètres de la batterie du système	Impostazioni della batteria del sistema	Sistem pil ayarları	Pengaturan baterai sistem	การตั้งค่าแบตเตอรี่ของระบบ	システムバッテリー設定	시스템 배터리 설정	系统电池设置
title_activity_system_settings	System settings	Ustawienia systemowe	Systemeinstellungen	Ajustes del sistema	Configurações de sistema	Les paramètres du système	Impostazioni di sistema	Sistem ayarları	Pengaturan sistem	การตั้งค่าระบบ	システム設定	환경 설정	系统设置
title_activity_events_settings	Notification Settings	Ustawienia powiadomień	Benachrichtigungseinstellungen	Configuración de las notificaciones	Configurações de notificação	Paramètres de notification	Impostazioni di notifica	Bildirim ayarları	Pengaturan pemberitahuan	การตั้งค่าการแจ้งเตือน	通知設定	알림 설정	通知设置
title_activity_speech_settings	Speech Settings	Ustawienia mowy	Spracheinstellungen	Configuración de voz	Configurações de fala	Paramètres vocaux	Impostazioni vocali	Konuşma Ayarları	Pengaturan Pidato	การตั้งค่าคำพูด	音声設定	음성 설정	语音设置
title_activity_help	Help	Pomoc	Helfen	Ayuda	Ajuda	Aide	Aiuto	Yardım	Membantu	ช่วย	ヘルプ	돕다	帮助
title_activity_tips	Energy tips	Porady energetyczne	Energietipps	Consejos energéticos	Dicas de energia	Conseils énergétiques	Consigli energetici	Enerji ipuçları	Kiat energi	เคล็ดลับด้านพลังงาน	エネルギーに関するヒント	에너지 팁	能量小贴士
title_activity_about	About application	O aplikacji	Über die Anwendung	Acerca de la aplicación	Sobre o aplicativo	À propos de la candidature	Informazioni sull\'applicazione	Başvuru hakkında	Tentang aplikasi	เกี่ยวกับการสมัคร	アプリケーションについて	신청에 대해	关于申请
permission_granted	Permission Granted	Uprawnienie przydzielone	Erlaubnis erteilt	Permiso concedido	Permissão garantida	Permission accordée	Permesso accordato	İzin verildi	Izin diberikan	ได้รับอนุญาต	許可が与えられました	허가가 부여되었습니다	许可授予
permission_denied	Permission Denied	Uprawnienie zablokowane	Zugriff verweigert	Permiso denegado	Permissão negada	Permission refusée	Permesso negato	İzin reddedildi	Izin ditolak	การอนุญาตถูกปฏิเสธ	許可が拒否されました	권한이 거부되었습니다	没有权限
exception_unknown	Unknown error	Nieznany błąd	Unbekannter Fehler	Error desconocido	Erro desconhecido	Erreur inconnue	Errore sconosciuto	Bilinmeyen hata	Kesalahan yang tidak diketahui	ข้อผิดพลาดที่ไม่รู้จัก	不明なエラー	알수없는 오류	未知错误
exception_missing	Missing	Brakuje	Fehlen	Desaparecido	Ausente	Manquant	Mancante	Eksik	Hilang	หายไป	ない	없어진	丢失的
task_success	Success	Sukces	Erfolg	Éxito	Sucesso	Succès	Successo	Başarı	Kesuksesan	ความสำเร็จ	成功	성공	成功
task_failure	Failure	Niepowodzenie	Versagen	Falla	Falha	Échec	Fallimento	Arıza	Kegagalan	ความล้มเหลว	失敗	실패	失败
internet_connection_missing	Check your network connection	Sprawdź połączenie sieciowe	Überprüfen Sie Ihre Netzwerkverbindung	Comprueba tu conexión de red	Verifique sua conexão de rede	Vérifiez votre connexion réseau	Controlla la tua connessione di rete	Ağ bağlantınızı kontrol edin	Periksa koneksi jaringan Anda	ตรวจสอบการเชื่อมต่อเครือข่ายของคุณ	ネットワーク接続を確認してください	네트워크 연결을 확인하세요.	检查您的网络连接
dialog_application_close_question	Do you want to close application?	Czy chcesz zamknąć aplikację?	Möchten Sie die Anwendung schließen?	¿Quieres cerrar la aplicación?	Deseja fechar o aplicativo?	Voulez-vous fermer l\'application ?	Vuoi chiudere l\'applicazione?	Uygulamayı kapatmak istiyor musunuz?	Apakah Anda ingin menutup aplikasi?	คุณต้องการปิดแอปพลิเคชันหรือไม่?	アプリケーションを閉じますか?	애플리케이션을 종료하시겠습니까?	您想关闭应用程序吗？
dialog_yes	Yes	Tak	Ja	Sí	Sim	Oui	SÌ	Evet	Ya	ใช่	はい	예	是的
dialog_no	No	Nie	NEIN	No	Não	Non	NO	HAYIR	TIDAK	เลขที่	いいえ	아니요	不
dialog_preferences_clear_title	Restore parameters	Przywróć parametry	Parameter wiederherstellen	Restaurar parámetros	Restaurar parâmetros	Restaurer les paramètres	Ripristinare i parametri	Parametreleri geri yükle	Kembalikan parameter	คืนค่าพารามิเตอร์	パラメータを復元する	매개변수 복원	恢复参数
dialog_preferences_clear_question	Do you want to restore the default parameters?	Czy chcesz przywrócić domyślne parametry?	Möchten Sie die Standardparameter wiederherstellen?	¿Quieres restaurar los parámetros predeterminados?	Deseja restaurar os parâmetros padrão?	Voulez-vous restaurer les paramètres par défaut ?	Vuoi ripristinare i parametri predefiniti?	Varsayılan parametreleri geri yüklemek istiyor musunuz?	Apakah Anda ingin mengembalikan parameter default?	คุณต้องการกู้คืนพารามิเตอร์เริ่มต้นหรือไม่	デフォルトのパラメータを復元しますか?	기본 매개변수를 복원하시겠습니까?	您想恢复默认参数吗？
dialog_preferences_clear_success	Parameters restored	Parametry przywrócone	Parameter wiederhergestellt	Parámetros restaurados	Parâmetros restaurados	Paramètres restaurés	Parametri ripristinati	Parametreler geri yüklendi	Parameter dipulihkan	คืนค่าพารามิเตอร์แล้ว	パラメータが復元されました	매개변수가 복원되었습니다.	参数恢复
remove_ads	Remove ads	Usuń reklamy	Anzeigen entfernen	Quitar anuncios	Remover propagandas	Supprimez la pub	Rimuovere gli annunci	Reklamları kaldırmak	Hilangkan iklan	ลบโฆษณา	広告を削除	광고를 제거하다	移除广告
command_open	Open	Otwórz	Offen	Abierto	Abrir	Ouvrir	Aprire	Açık	Membuka	เปิด	開ける	열려 있는	打开
battery_monitor	Monitor	Monitor	Monitor	Monitor	Monitor	Moniteur	Tenere sotto controllo	Monitör	Memantau	เฝ้าสังเกต	モニター	감시 장치	监视器
screen_lock	Screen lock	Blokada wygaszania ekranu	Bildschirmsperre	Bloqueo de pantalla	Bloqueio de tela	Verrouillage d\'écran	Blocco schermo	Ekran kilidi	Pengunci layar	ล็อคหน้าจอ	スクリーンロック	화면 잠금	屏幕锁
full_screen	Full screen	Pełny ekran	Ganzer Bildschirm	Pantalla completa	Tela cheia	Plein écran	A schermo intero	Tam ekran	Layar penuh	เต็มจอ	全画面表示	전체 화면	全屏
turn_sound_on	Turn on the sound	Włącz dźwięk	Schalten Sie den Ton ein	enciende el sonido	Ligue o som	Allume le son	Attiva l\'audio	Sesi aç	Nyalakan suaranya	เปิดเสียง	サウンドをオンにしてください	소리를 켜세요	打开声音
translation_word	translation	tłumaczenie	Übersetzung	Traducción	Tradução	Traduction	Traduzione	Çeviri	Terjemahan	การแปล	翻訳	번역	翻译
male_word	male	mężczyzna	Mann	Hombre	Homem	Homme	Uomo	Erkek	Laki-laki	ชาย	男性	남자	男性
female_word	female	kobieta	Frau	Mujer	Mulher	Femme	Donna	Kadın	Perempuan	ผู้หญิง	女性	여자	女性
preference_value_on	On	Tak	An	En	Sobre	Sur	SU	Açık	Pada	บน	の上	~에	在
preference_value_off	Off	Nie	Aus	Apagado	Desligado	Désactivé	Spento	Kapalı	Mati	ปิด	オフ	끄다	离开
preference_value_never	Never	Nigdy	Niemals	Nunca	Nunca	Jamais	Mai	Asla	Tidak pernah	ไม่เคย	一度もない	절대	绝不
preference_value_always	Always	Zawsze	Stets	Siempre	Sempre	Toujours	Sempre	Her zaman	Selalu	เสมอ	いつも	언제나	总是
preference_value_on_charging	While charging	Podczas ładowania	Während des Ladevorgangs	Mientras carga	Durante o carregamento	Pendant le chargement	Durante la ricarica	Şarj olurken	Saat mengisi daya	ขณะชาร์จ	充電中	충전 중	充电时
preference_value_on_discharging	While discharging	Podczas rozładowania	Beim Entladen	mientras descarga	Durante a descarga	Pendant la décharge	Durante lo scarico	Boşalırken	Saat pemakaian	ขณะกำลังคายประจุ	放電中	방전하는 동안	放电时
preferences_main_title	Basic	Podstawowe	Basic	Básico	Básico	Basique	Di base	Temel	Dasar	ขั้นพื้นฐาน	基本	기초적인	基本的
preference_main_app_locale	Application language	Język aplikacji	Anwendungssprache	Idioma de la aplicación	Idioma do aplicativo	Langue de candidature	Lingua dell\'applicazione	Uygulama dili	Bahasa aplikasi	ภาษาของแอปพลิเคชัน	アプリケーション言語	응용 언어	应用语言
preference_main_debug	Debug mode	Tryb debug	Debug-Modus	Modo de depuración	Modo de depuração	Mode débogage	Modalità di debug	Hata ayıklama modu	Modus debug	โหมดแก้ไขข้อบกพร่อง	デバッグモード	디버그 모드	调试模式
preference_main_screen_mode	Theme day/night	Wygląd dzienny/nocny	Thema Tag/Nacht	Tema día/noche	Tema dia/noite	Journée/soirée à thème	Tema giorno/notte	Tema gündüz/gece	Tema siang/malam	ธีมกลางวัน/กลางคืน	昼/夜のテーマ	테마 낮/밤	主题日/夜
preference_main_screen_mode_system	System - no change	Systemowy - bez zmian	System - keine Änderung	Sistema - sin cambios	Sistema - sem alteração	Système - aucun changement	Sistema: nessun cambiamento	Sistem - değişiklik yok	Sistem - tidak ada perubahan	ระบบ - ไม่มีการเปลี่ยนแปลง	システム - 変更なし	시스템 - 변화 없음	系统-无变化
preference_main_screen_mode_day	Day	Dzienny	Tag	Día	Dia	Jour	Giorno	Gün	Hari	วัน	日	낮	天
preference_main_screen_mode_night	Night	Nocny	Nacht	Noche	Noite	Nuit	Notte	Gece	Malam	กลางคืน	夜	밤	夜晚
preference_main_separator_decimal	Decimal separator	Separator dziesiętny	Dezimaltrennzeichen	Separador decimal	Separador decimal	Séparateur décimal	Separatore decimale	Ondalık ayırıcı	Pemisah desimal	ตัวคั่นทศนิยม	小数点区切り文字	소수 구분 기호	小数点分隔符
preference_main_separator_dot	Use dot	Użyj kropki	Verwenden Sie Punkt	usar punto	Usar ponto	Utiliser le point	Usa il punto	Nokta kullan	Gunakan titik	ใช้จุด	ドットを使用する	점 사용	使用点
preference_main_separator_comma	Use comma	Użyj przecinka	Verwenden Sie Komma	usar coma	Usar vírgula	Utiliser une virgule	Usa la virgola	Virgül kullan	Gunakan koma	ใช้ลูกน้ำ	カンマを使用する	쉼표를 사용하세요	使用逗号
preference_main_temperature_measure	Temperature unit	Jednostka temperatury	Temperatureinheit	Unidad de temperatura	Unidade de temperatura	Unité de température	Unità di temperatura	Sıcaklık birimi	Satuan suhu	หน่วยอุณหภูมิ	温度単位	온도 단위	温度单位
preference_main_temperature_celsius	Use degrees celsius	Użyj stopni celsjusza	Verwenden Sie Grad Celsius	Usa grados centígrados	Usar graus Celsius	Utiliser des degrés Celsius	Usa i gradi Celsius	Santigrat dereceyi kullanın	Gunakan derajat celcius	ใช้องศาเซลเซียส	摂氏度を使用する	섭씨 온도 사용	使用摄氏度
preference_main_temperature_fahrenheit	Use degrees fahrenheit	Użyj stopni fahrenheita	Verwenden Sie Grad Fahrenheit	Usa grados fahrenheit	Usar graus Fahrenheit	Utiliser les degrés Fahrenheit	Usa i gradi Fahrenheit	Fahrenheit derecesini kullan	Gunakan derajat fahrenheit	ใช้องศาฟาเรนไฮต์	華氏を使用	화씨를 사용하세요	使用华氏度
preference_temperature_average_values	Temperature - average values	Temperatura - wartości średnie	Temperatur - Durchschnittswerte	Temperatura - valores medios	Temperatura - valores médios	Température - valeurs moyennes	Temperatura - valori medi	Sıcaklık - ortalama değerler	Suhu - nilai rata-rata	อุณหภูมิ - ค่าเฉลี่ย	温度 - 平均値	온도 - 평균값	温度 - 平均值
preference_voltage_average_values	Voltage - average values	Napięcie - wartości średnie	Spannung - Durchschnittswerte	Tensión - valores medios	Tensão - valores médios	Tension - valeurs moyennes	Voltaggio - valori medi	Gerilim - ortalama değerler	Tegangan - nilai rata-rata	แรงดันไฟฟ้า - ค่าเฉลี่ย	電圧 - 平均値	전압 - 평균값	电压 - 平均值
preference_average_values_none	Hide	Ukryj	Verstecken	Esconder	Esconder	Cacher	Nascondere	Saklamak	Bersembunyi	ซ่อน	隠れる	숨다	隐藏
preference_average_values_from_app_install	From application installation(parameters reset)	Od instalacji aplikacji(przywrócenia parametrów)	Von der Anwendungsinstallation(Parameter zurückgesetzt)	Desde la instalación de la aplicación(restablecimiento de parámetros)	Da instalação do aplicativo(redefinição de parâmetros)	Depuis l\'installation de l\'application(réinitialisation des paramètres)	Dall\'installazione dell\'applicazione(reimpostazione dei parametri)	Uygulama kurulumundan(parametrelerin sıfırlanması)	Dari instalasi aplikasi(reset parameter)	จากการติดตั้งแอปพลิเคชัน(รีเซ็ตพารามิเตอร์)	アプリケーションインストールから（パラメータリセット）	애플리케이션 설치(매개변수 재설정)에서	从应用程序安装（参数重置）
preference_average_values_from_app_start	From application start	Od startu aplikacji	Ab Bewerbungsstart	Desde el inicio de la aplicación	Desde o início do aplicativo	Dès le début de l\'application	Dall\'inizio dell\'applicazione	Uygulama başlangıcından	Dari awal aplikasi	ตั้งแต่เริ่มต้นการสมัคร	アプリ起動から	신청 시작부터	从申请开始
