app_lang_sign	en	pl	de	es	pt	fr	it	tr	id	th	ja	ko	zh
app_help_05_details	Timely periodic notification enables battery status notifications regularly at selected intervals. Notification on the phone\'s unlock button triggers the notification when you press the phone\'s power button. You can add the current time to notifications. This is a useful feature if you walk or run with your phone, and you don\'t want to check the time on the screen.	Okresowe powiadamianie na czas włącza powiadamianie o stanie baterii regularnie w wybranych odstępach czasu. Powiadamianie na przycisk odblokowania telefonu uruchamia powiadomienie po wciśnięciu przycisku zasilania telefonu. Możesz dodać aktualny czas do powiadmień. Jest to przydatna funkcja jeśli chodzisz lub biegasz z telefonem, i nie chcesz sprawdzać czasu na ekranie.	Die rechtzeitige regelmäßige Benachrichtigung ermöglicht regelmäßige Batteriestatusbenachrichtigungen in ausgewählten Intervallen. Die Benachrichtigung auf der Entsperrtaste des Telefons löst die Benachrichtigung aus, wenn Sie die Ein-/Aus-Taste des Telefons drücken. Sie können Benachrichtigungen die aktuelle Uhrzeit hinzufügen. Dies ist eine nützliche Funktion, wenn Sie mit Ihrem Telefon gehen oder laufen und die Uhrzeit nicht auf dem Bildschirm überprüfen möchten.	La notificación periódica oportuna permite recibir notificaciones periódicas del estado de la batería a intervalos seleccionados. La notificación en el botón de desbloqueo del teléfono activa la notificación cuando presiona el botón de encendido del teléfono. Puede agregar la hora actual a las notificaciones. Esta es una característica útil si caminas o corres con tu teléfono y no quieres consultar la hora en la pantalla.	A notificação periódica oportuna permite notificações regulares do status da bateria em intervalos selecionados. A notificação no botão de desbloqueio do telefone aciona a notificação quando você pressiona o botão liga/desliga do telefone. Você pode adicionar a hora atual às notificações. Este é um recurso útil se você anda ou corre com o telefone e não deseja verificar a hora na tela.	Une notification périodique en temps opportun permet de recevoir régulièrement des notifications sur l\'état de la batterie à des intervalles sélectionnés. La notification sur le bouton de déverrouillage du téléphone déclenche la notification lorsque vous appuyez sur le bouton d\'alimentation du téléphone. Vous pouvez ajouter l\'heure actuelle aux notifications. Il s\'agit d\'une fonctionnalité utile si vous marchez ou courez avec votre téléphone et que vous ne souhaitez pas vérifier l\'heure à l\'écran.	La notifica periodica tempestiva consente di ricevere regolarmente notifiche sullo stato della batteria a intervalli selezionati. La notifica sul pulsante di sblocco del telefono attiva la notifica quando si preme il pulsante di accensione del telefono. Puoi aggiungere l\'ora corrente alle notifiche. Questa è una funzionalità utile se cammini o corri con il telefono e non vuoi controllare l\'ora sullo schermo.	Zamanında periyodik bildirim, pil durumu bildirimlerinin seçilen aralıklarla düzenli olarak gönderilmesini sağlar. Telefonun kilit açma düğmesindeki bildirim, telefonun güç düğmesine bastığınızda bildirimi tetikler. Bildirimlere güncel saati ekleyebilirsiniz. Telefonunuzla yürüyor veya koşuyorsanız ve ekrandaki saati kontrol etmek istemiyorsanız bu kullanışlı bir özelliktir.	Pemberitahuan berkala yang tepat waktu memungkinkan pemberitahuan status baterai secara teratur pada interval yang dipilih. Notifikasi pada tombol buka kunci ponsel memicu notifikasi saat Anda menekan tombol daya ponsel. Anda dapat menambahkan waktu saat ini ke notifikasi. Ini adalah fitur yang berguna jika Anda berjalan atau berlari dengan ponsel, dan tidak ingin memeriksa waktu di layar.	การแจ้งเตือนเป็นระยะอย่างทันท่วงทีช่วยให้สามารถแจ้งเตือนสถานะแบตเตอรี่เป็นประจำตามช่วงเวลาที่เลือก การแจ้งเตือนบนปุ่มปลดล็อคของโทรศัพท์จะทำให้เกิดการแจ้งเตือนเมื่อคุณกดปุ่มเปิด/ปิดของโทรศัพท์ คุณสามารถเพิ่มเวลาปัจจุบันในการแจ้งเตือนได้ นี่เป็นคุณสมบัติที่มีประโยชน์หากคุณเดินหรือวิ่งด้วยโทรศัพท์ และคุณไม่ต้องการตรวจสอบเวลาบนหน้าจอ	タイムリーな定期通知により、選択した間隔で定期的にバッテリー状態を通知できます。携帯電話のロック解除ボタンの通知は、携帯電話の電源ボタンを押したときに通知をトリガーします。通知に現在の時刻を追加できます。これは、スマートフォンを持って歩いたり走ったりするときに、画面で時間を確認したくない場合に便利な機能です。	적시에 주기적 알림을 사용하면 선택한 간격에 따라 정기적으로 배터리 상태 알림을 사용할 수 있습니다. 휴대전화의 잠금 해제 버튼에 대한 알림은 휴대전화의 전원 버튼을 누를 때 알림을 실행합니다. 알림에 현재 시간을 추가할 수 있습니다. 휴대폰을 들고 걷거나 뛸 때, 화면으로 시간을 확인하고 싶지 않을 때 유용한 기능입니다.	及时的定期通知可以按选定的时间间隔定期通知电池状态。当您按下手机电源按钮时，手机解锁按钮上的通知会触发通知。您可以将当前时间添加到通知中。如果您带着手机走路或跑步，并且不想查看屏幕上的时间，那么此功能非常有用。
app_tips_01_title	Adjust screen timeout and brightness	Dostosuj czas wygaszania ekranu i jasność	Passen Sie das Bildschirm-Timeout und die Helligkeit an	Ajustar el tiempo de espera y el brillo de la pantalla	Ajustar o tempo limite e o brilho da tela	Ajuster le délai d\'expiration et la luminosité de l\'écran	Regola il timeout e la luminosità dello schermo	Ekran zaman aşımını ve parlaklığını ayarlayın	Sesuaikan batas waktu dan kecerahan layar	ปรับการหมดเวลาและความสว่างของหน้าจอ	画面のタイムアウトと明るさを調整する	화면 시간 초과 및 밝기 조정	调整屏幕超时和亮度
app_tips_01_details	Shorten the screen timeout duration to ensure the screen turns off quickly when not in use. Lower the screen brightness or enable adaptive brightness to optimize energy consumption. The screen is the biggest battery drain on your phone, consuming up to 70% of the power. Remove unnecessary widgets from the home screen, as they can consume resources and drain the battery. For phones with OLED or AMOLED screens, using a dark wallpaper can save power, as these screens illuminate individual pixels.	Aby zmniejszyć zużycie baterii, możesz dostosować czas wygaszania ekranu i jasność. Skróć czas wygaszania ekranu do minimum, aby ekran szybko wygasł, gdy nie jest używany. Zmniejsz jasność ekranu lub włącz automatyczną jasność, aby ekran dostosowywał się do otoczenia. Usuń niepotrzebne widżety z ekranu głównego, ponieważ mogą one zużywać zasoby i rozładowywać baterię. W przypadku telefonów z ekranami OLED lub AMOLED korzystanie z ciemnej tapety może zaoszczędzić energię, ponieważ te ekrany podświetlają poszczególne piksele.	Verkürzen Sie die Bildschirm-Timeout-Dauer, um sicherzustellen, dass sich der Bildschirm bei Nichtgebrauch schnell ausschaltet. Verringern Sie die Bildschirmhelligkeit oder aktivieren Sie die adaptive Helligkeit, um den Energieverbrauch zu optimieren. Der Bildschirm ist der größte Akkufresser Ihres Telefons und verbraucht bis zu 70 % of Strom. Entfernen Sie unnötige Widgets vom Startbildschirm, da diese Ressourcen verbrauchen und den Akku entladen können. Bei Telefonen mit OLED- oder AMOLED-Bildschirmen kann die Verwendung eines dunklen Hintergrundbilds Strom sparen, da diese Bildschirme einzelne Pixel beleuchten.	Acorte la duración del tiempo de espera de la pantalla para garantizar que se apague rápidamente cuando no esté en uso. Reduzca el brillo de la pantalla o habilite el brillo adaptativo para optimizar el consumo de energía. La pantalla es el mayor consumidor de batería de tu teléfono, ya que consume hasta un 70% of de energía. Elimina los widgets innecesarios de la pantalla de inicio, ya que pueden consumir recursos y agotar la batería. Para teléfonos con pantallas OLED o AMOLED, usar un fondo de pantalla oscuro puede ahorrar energía, ya que estas pantallas iluminan píxeles individuales.	Reduza o tempo limite da tela para garantir que ela desligue rapidamente quando não estiver em uso. Reduza o brilho da tela ou ative o brilho adaptável para otimizar o consumo de energia. A tela é o que mais consome bateria do seu smartphone, consumindo até 70% of de energia. Remova widgets desnecessários da tela inicial, pois eles podem consumir recursos e esgotar a bateria. Para telefones com telas OLED ou AMOLED, usar um papel de parede escuro pode economizar energia, pois essas telas iluminam pixels individuais.	Réduisez la durée d\'expiration de l\'écran pour garantir que l\'écran s\'éteint rapidement lorsqu\'il n\'est pas utilisé. Réduisez la luminosité de l’écran ou activez la luminosité adaptative pour optimiser la consommation d’énergie. L\'écran représente la plus grande consommation de batterie de votre téléphone, consommant jusqu\'à 70 % o f d\'énergie. Supprimez les widgets inutiles de l\'écran d\'accueil, car ils peuvent consommer des ressources et vider la batterie. Pour les téléphones dotés d\'écrans OLED ou AMOLED, l\'utilisation d\'un fond d\'écran sombre peut économiser de l\'énergie, car ces écrans éclairent des pixels individuels.	Ridurre la durata del timeout dello schermo per garantire che lo schermo si spenga rapidamente quando non viene utilizzato. Abbassa la luminosità dello schermo o attiva la luminosità adattiva per ottimizzare il consumo energetico. Lo schermo consuma maggiormente la batteria del tuo telefono, consumando fino al 70% o di energia. Rimuovi i widget non necessari dalla schermata principale, poiché possono consumare risorse e scaricare la batteria. Per i telefoni con schermi OLED o AMOLED, l\'utilizzo di uno sfondo scuro può far risparmiare energia, poiché questi schermi illuminano i singoli pixel.	Ekranın kullanılmadığında hızlı bir şekilde kapanmasını sağlamak için ekran zaman aşımı süresini kısaltın. Enerji tüketimini optimize etmek için ekran parlaklığını azaltın veya uyarlanabilir parlaklığı etkinleştirin. Ekran, telefonunuzun en fazla pil tüketen kısmıdır ve 70% of\'ye kadar güç tüketir. Kaynakları tüketebilecekleri ve pili tüketebilecekleri için gereksiz widget\'ları ana ekrandan kaldırın. OLED veya AMOLED ekranlı telefonlar için koyu renkli bir duvar kağıdı kullanmak, bu ekranlar tek tek pikselleri aydınlatacağından güç tasarrufu sağlayabilir.	Persingkat durasi waktu tunggu layar untuk memastikan layar mati dengan cepat saat tidak digunakan. Turunkan kecerahan layar atau aktifkan kecerahan adaptif untuk mengoptimalkan konsumsi energi. Layar merupakan pengurasan baterai terbesar di ponsel Anda, menghabiskan daya hingga 70% o. Hapus widget yang tidak diperlukan dari layar beranda, karena dapat menghabiskan sumber daya dan menguras baterai. Untuk ponsel dengan layar OLED atau AMOLED, menggunakan wallpaper gelap dapat menghemat daya, karena layar ini menerangi setiap piksel.	ลดระยะเวลาหมดเวลาหน้าจอเพื่อให้แน่ใจว่าหน้าจอจะปิดอย่างรวดเร็วเมื่อไม่ได้ใช้งาน ลดความสว่างหน้าจอหรือเปิดใช้งานความสว่างที่ปรับได้เพื่อเพิ่มประสิทธิภาพการใช้พลังงาน หน้าจอคือแบตเตอรี่ที่ระบายออกมากที่สุดในโทรศัพท์ โดยสิ้นเปลืองพลังงานสูงสุดถึง 70% of ลบวิดเจ็ตที่ไม่จำเป็นออกจากหน้าจอหลัก เนื่องจากอาจใช้ทรัพยากรและทำให้แบตเตอรี่หมด สำหรับโทรศัพท์ที่มีหน้าจอ OLED หรือ AMOLED การใช้วอลเปเปอร์สีเข้มสามารถประหยัดพลังงานได้ เนื่องจากหน้าจอเหล่านี้ให้แสงสว่างแต่ละพิกเซล	画面のタイムアウト時間を短くして、使用していないときに画面がすぐにオフになるようにします。画面の明るさを下げるか、適応型明るさを有効にしてエネルギー消費を最適化します。画面はスマートフォンで最もバッテリーを消耗する部分であり、最大 70% of の電力を消費します。不要なウィジェットはリソースを消費し、バッテリーを消耗する可能性があるため、ホーム画面から削除します。OLED または AMOLED 画面を備えた携帯電話の場合、暗い壁紙を使用すると、これらの画面が個々のピクセルを照らすため、電力を節約できます。	사용하지 않을 때 화면이 빨리 꺼지도록 화면 시간 초과 기간을 줄입니다. 화면 밝기를 낮추거나 적응형 밝기를 활성화하여 에너지 소비를 최적화하세요. 화면은 휴대전화에서 배터리를 가장 많이 소모하는 부분으로 최대 70% o의 전력을 소모합니다. 리소스를 소모하고 배터리를 소모할 수 있으므로 홈 화면에서 불필요한 위젯을 제거하세요. OLED 또는 AMOLED 화면이 있는 휴대폰의 경우 어두운 배경 화면을 사용하면 화면이 개별 픽셀을 밝히므로 전력을 절약할 수 있습니다.	缩短屏幕超时时间，确保屏幕在不使用时快速关闭。降低屏幕亮度或启用自适应亮度以优化能耗。屏幕是手机上耗电量最大的部分，消耗高达 70% of 的电量。从主屏幕上删除不必要的小部件，因为它们会消耗资源并耗尽电池。对于配备 OLED 或 AMOLED 屏幕的手机，使用深色壁纸可以节省电量，因为这些屏幕会照亮各个像素。
app_tips_02_title	Turn off unused connections	Wyłączaj nieużywane połączenia	Schalten Sie ungenutzte Verbindungen aus	Desactivar conexiones no utilizadas	Desligue conexões não utilizadas	Désactivez les connexions inutilisées	Disattiva le connessioni non utilizzate	Kullanılmayan bağlantıları kapatın	Matikan koneksi yang tidak digunakan	ปิดการเชื่อมต่อที่ไม่ได้ใช้	未使用の接続をオフにする	사용하지 않는 연결 끄기	关闭未使用的连接
app_tips_02_details	Disabling Wi-Fi, Bluetooth, and GPS Localization when not needed prevents these features from continuously searching for connections, which can significantly drain the battery.	Wyłączanie Wi-Fi, Bluetooth i Lokalizacji GPS, gdy nie są używane, może znacznie wydłużyć żywotność baterii, ponieważ zapobiega ciągłemu wyszukiwaniu połączeń przez te funkcje. Wi-Fi stale szuka dostępnych sieci, nawet jeśli nie jesteś do nich podłączony. Bluetooth wyczerpuje baterię nawet wtedy, gdy nie jest używany. Lokalizacja GPS zużywa dużo energii, ponieważ stale szuka sygnału GPS. Wyłączanie tych funkcji, gdy nie są potrzebne, może znacznie poprawić wydajność baterii telefonu.	Durch das Deaktivieren von WLAN, Bluetooth und GPS-Lokalisierung, wenn diese nicht benötigt werden, wird verhindert, dass diese Funktionen ständig nach Verbindungen suchen, was den Akku erheblich belasten kann.	Desactivar Wi-Fi, Bluetooth y localización GPS cuando no son necesarios evita que estas funciones busquen conexiones continuamente, lo que puede agotar significativamente la batería.	Desativar Wi-Fi, Bluetooth e localização GPS quando não for necessário evita que esses recursos procurem conexões continuamente, o que pode esgotar significativamente a bateria.	La désactivation du Wi-Fi, du Bluetooth et de la localisation GPS lorsqu\'elle n\'est pas nécessaire empêche ces fonctionnalités de rechercher en permanence des connexions, ce qui peut épuiser considérablement la batterie.	La disattivazione di Wi-Fi, Bluetooth e localizzazione GPS quando non è necessaria impedisce a queste funzionalità di cercare continuamente connessioni, il che può consumare notevolmente la batteria.	Gerekmediğinde Wi-Fi, Bluetooth ve GPS Yerelleştirmesinin devre dışı bırakılması, bu özelliklerin sürekli olarak bağlantı aramasını engeller ve bu da pilin önemli ölçüde tükenmesine neden olabilir.	Menonaktifkan Wi-Fi, Bluetooth, dan Lokalisasi GPS bila tidak diperlukan akan mencegah fitur-fitur ini terus mencari koneksi, yang dapat menguras baterai secara signifikan.	การปิดใช้งานการแปล Wi-Fi, Bluetooth และ GPS เมื่อไม่จำเป็นจะป้องกันคุณสมบัติเหล่านี้จากการค้นหาการเชื่อมต่ออย่างต่อเนื่อง ซึ่งจะทำให้แบตเตอรี่หมดลงอย่างมาก	必要のないときに Wi-Fi、Bluetooth、GPS ローカリゼーションを無効にすると、これらの機能が継続的に接続を検索できなくなり、バッテリーが大幅に消耗する可能性があります。	필요하지 않을 때 Wi-Fi, Bluetooth 및 GPS 위치 파악을 비활성화하면 이러한 기능이 지속적으로 연결을 검색하지 못하게 되어 배터리가 크게 소모될 수 있습니다.	在不需要时禁用 Wi-Fi、蓝牙和 GPS 定位可防止这些功能持续搜索连接，从而严重消耗电池电量。
app_tips_03_title	Manage background applications	Zarządzaj aplikacjami działającymi w tle	Hintergrundanwendungen verwalten	Administrar aplicaciones en segundo plano	Gerenciar aplicativos em segundo plano	Gérer les applications en arrière-plan	Gestisci le applicazioni in background	Arka plan uygulamalarını yönetin	Kelola aplikasi latar belakang	จัดการแอปพลิเคชันพื้นหลัง	バックグラウンドアプリケーションを管理する	백그라운드 애플리케이션 관리	管理后台应用程序
