app_lang_sign	en	pl	de	es	pt	fr	it	tr	id	th	ja	ko	zh	ar	ru	uk	vi	hi	bn	ur	ms	sw	he	el	nl	sv	ro	hu	cs	sk	sr	bg
intro_text_20	or battery with detailed parameters such as	lub baterie ze szczegółowymi parametrami takimi jak	oder Batterie mit detaillierten Parametern wie	o batería con parámetros detallados como	ou bateria com parâmetros detalhados, como	Ou batterie avec des paramètres détaillés tels que	o batteria con parametri dettagliati come	veya pil gibi ayrıntılı parametrelere sahip	atau baterai dengan parameter terperinci seperti	หรือแบตเตอรี่ที่มีรายละเอียดพารามิเตอร์เช่น	またはバッテリーなどの詳細なパラメータ	또는 다음과 같은 세부 매개변수가 있는 배터리	或具有详细参数的电池，例如	أو البطارية ذات المعلمات التفصيلية مثل	или аккумулятор с подробными параметрами, такими как	або акумулятор із детальними параметрами, наприклад	hoặc pin với thông số chi tiết như	या विस्तृत पैरामीटर वाली बैटरी जैसे	বা বিস্তারিত পরামিতি সহ ব্যাটারি যেমন	یا تفصیلی پیرامیٹرز کے ساتھ بیٹری جیسے	atau bateri dengan parameter terperinci seperti	au betri yenye vigezo vya kina kama vile	או סוללה עם פרמטרים מפורטים כגון	ή μπαταρία με λεπτομερείς παραμέτρους όπως	of batterij met gedetailleerde parameters zoals	eller batteri med detaljerade parametrar som	sau baterie cu parametri detaliați, cum ar fi	vagy akkumulátor részletes paraméterekkel, mint például	nebo baterii s podrobnými parametry, jako je	alebo batériu s podrobnými parametrami, ako je	ili bateriju sa detaljnim parametrima kao što su	или батерия с подробни параметри като
intro_text_21	charge level	poziom naładowania	Ladezustand	nivel de carga	nível de carga	niveau de charge	livello di carica	şarj seviyesi	tingkat biaya	ระดับการชาร์จ	充電レベル	충전 수준	充电水平	مستوى الشحن	уровень заряда	рівень заряду	mức phí	चार्ज स्तर	চার্জ স্তর	چارج کی سطح	paras pengecasan	kiwango cha chaji	רמת טעינה	επίπεδο φόρτισης	laadniveau	laddnivå	nivelul de încărcare	töltöttségi szint	úroveň nabití	úroveň nabitia	nivo napunjenosti	ниво на зареждане
intro_text_22	temperature	temperatura	Temperatur	temperatura	temperatura	température	temperatura	sıcaklık	suhu	อุณหภูมิ	温度	온도	温度	درجة حرارة	температура	температура	nhiệt độ	तापमान	তাপমাত্রা	درجہ حرارت	suhu	joto	טמפרטורה	θερμοκρασία	temperatuur	temperatur	temperatura	hőmérséklet	teplota	teplota	temperatura	температура
intro_text_23	voltage	napięcie	Stromspannung	Voltaje	tensão	tension	voltaggio	Gerilim	tegangan	แรงดันไฟฟ้า	電圧	전압	电压	الجهد االكهربى	Напряжение	Напруга	Vôn	वोल्टेज	ভোল্টেজ, বৈদ্যুতিক একক বিশেষ	وولٹیج	voltan	voltage	מתח	τάση	voltage	spänning	tensiunea	feszültség	napětí	napätie	napon	напрежение
intro_text_24	charging current on some phones	prąd ładowania na niektórych telefonach	Ladestrom bei einigen Telefonen	cargando corriente en algunos teléfonos	corrente de carregamento em alguns telefones	courant de charge sur certains téléphones	corrente di carica su alcuni telefoni	bazı telefonlarda şarj akımı	pengisian arus pada beberapa ponsel	กำลังชาร์จปัจจุบันในโทรศัพท์บางรุ่น	一部の携帯電話の充電電流	일부 휴대폰의 충전 전류	某些手机 的充电电流	شحن التيار على بعض الهواتف	зарядный ток на некоторых телефонах	зарядний струм на деяких телефонах	dòng sạc trên một số điện thoại	कुछ फोन पर चार्जिंग करंट	কিছু ফোনে কারেন্ট চার্জ হচ্ছে	کچھ فونز پر کرنٹ چارج ہو رہا ہے۔	arus pengecasan pada sesetengah telefon	chaji ya sasa kwenye simu zingine	זרם טעינה בחלק מהטלפונים	ρεύμα φόρτισης σε ορισμένα τηλέφωνα	laadstroom op sommige telefoons	laddningsström på vissa telefoner	curentul de încărcare pe unele telefoane	töltőáram egyes telefonokon	nabíjecí proud u některých telefonů	nabíjací prúd na niektorých telefónoch	struja punjenja na nekim telefonima	ток на зареждане на някои телефони
intro_text_25	and their minimum, average and maximum values	oraz ich wartości minimalne, średnie i maksymalne	und ihre minimalen, durchschnittlichen und maximalen Werte	y sus valores mínimo, medio y máximo.	e seus valores mínimo, médio e máximo	et leurs valeurs minimales, moyennes et maximales	e i loro valori minimo, medio e massimo	ve bunların minimum, ortalama ve maksimum değerleri	dan nilai minimum, rata-rata, dan maksimumnya	และค่าต่ำสุด ค่าเฉลี่ย และค่าสูงสุด	およびその最小値、平均値、最大値	최소값, 평균값, 최대값	及其最小值、平均值和最大值	وقيمها الدنيا والمتوسطة والقصوى	и их минимальные, средние и максимальные значения	та їх мінімальне, середнє та максимальне значення	và các giá trị tối thiểu, trung bình và tối đa của chúng	और उनके न्यूनतम, औसत और अधिकतम मूल्य	এবং তাদের সর্বনিম্ন, গড় এবং সর্বোচ্চ মান	اور ان کی کم از کم، اوسط اور زیادہ سے زیادہ اقدار	dan nilai minimum, purata dan maksimumnya	na maadili yake ya chini, wastani na upeo	וערכיהם המינימליים, הממוצעים והמקסימליים	και τις ελάχιστες, μέσες και μέγιστες τιμές τους	en hun minimum-, gemiddelde- en maximumwaarden	och deras minimum-, medel- och maximumvärden	și valorile lor minime, medii și maxime	és ezek minimum, átlagos és maximum értékei	a jejich minimální, průměrné a maximální hodnoty	a ich minimálne, priemerné a maximálne hodnoty	i njihove minimalne, prosečne i maksimalne vrednosti	и техните минимални, средни и максимални стойности
intro_text_26	Use this button to prevent the screen from turning off	Użyj tego przycisku aby zablokować wygaszanie ekranu	Mit dieser Taste können Sie verhindern, dass sich der Bildschirm ausschaltet	Utilice este botón para evitar que la pantalla se apague	Use este botão para evitar que a tela desligue	Utilisez ce bouton pour empêcher l'écran de s'éteindre	Utilizzare questo pulsante per impedire lo spegnimento dello schermo	Ekranın kapanmasını önlemek için bu düğmeyi kullanın	Gunakan tombol ini untuk mencegah layar mati	ใช้ปุ่มนี้เพื่อป้องกันไม่ให้หน้าจอปิด	画面がオフになるのを防ぐには、このボタンを使用します	화면이 꺼지는 것을 방지하려면 이 버튼을 사용하세요.	使用此按钮可以防止屏幕关闭	استخدم هذا الزر لمنع إيقاف تشغيل الشاشة	Используйте эту кнопку, чтобы предотвратить выключение экрана	Використовуйте цю кнопку, щоб запобігти вимкненню екрана	Sử dụng nút này để ngăn màn hình tắt	स्क्रीन को बंद होने से रोकने के लिए इस बटन का उपयोग करें	এই বোতামটি ব্যবহার করুন যাতে স্ক্রীন বন্ধ না হয়	اسکرین کو بند ہونے سے روکنے کے لیے اس بٹن کا استعمال کریں۔	Gunakan butang ini untuk mengelakkan skrin daripada terpadam	Tumia kitufe hiki kuzuia skrini kuzima	השתמש בלחצן זה כדי למנוע כיבוי המסך	Χρησιμοποιήστε αυτό το κουμπί για να αποτρέψετε την απενεργοποίηση της οθόνης	Gebruik deze knop om te voorkomen dat het scherm uitschakelt	Använd den här knappen för att förhindra att skärmen stängs av	Utilizează acest buton pentru a împiedica oprirea ecranului	Használd ezt a gombot, hogy megakadályozd a képernyő kikapcsolását	Použijte toto tlačítko, abyste zabránili vypnutí obrazovky	Použite toto tlačidlo, aby ste zabránili vypnutiu obrazovky	Koristite ovo dugme da sprečite isključivanje ekrana	Използвай този бутон, за да предотвратиш изключването на екрана
intro_text_27	and here you can set additional application parameters such as	a tutaj możesz ustawić różne dodatkowe parametry aplikacji takie jak	und hier können Sie weitere Anwendungsparameter einstellen wie	y aquí puede configurar parámetros de aplicación adicionales como	e aqui você pode definir parâmetros adicionais do aplicativo, como	et ici, vous pouvez définir des paramètres d'application supplémentaires tels que	e qui puoi impostare parametri aggiuntivi dell'applicazione come	ve burada aşağıdaki gibi ek uygulama parametrelerini ayarlayabilirsiniz:	dan di sini Anda dapat mengatur parameter aplikasi tambahan seperti	และที่นี่คุณสามารถตั้งค่าพารามิเตอร์แอปพลิเคชันเพิ่มเติมได้ เช่น	ここで、次のような追加のアプリケーションパラメータを設定できます。	여기에서 다음과 같은 추가 애플리케이션 매개변수를 설정할 수 있습니다.	在这里您可以设置其他应用程序参数，例如	وهنا يمكنك تعيين معلمات تطبيق إضافية مثل	и здесь вы можете установить дополнительные параметры приложения, такие как	і тут ви можете встановити додаткові параметри програми, такі як	và tại đây bạn có thể đặt các tham số ứng dụng bổ sung như	और यहां आप अतिरिक्त एप्लिकेशन पैरामीटर सेट कर सकते हैं जैसे कि	এবং এখানে আপনি অতিরিক্ত অ্যাপ্লিকেশন পরামিতি সেট করতে পারেন যেমন	اور یہاں آپ اضافی ایپلیکیشن پیرامیٹرز سیٹ کر سکتے ہیں جیسے	dan di sini anda boleh menetapkan parameter aplikasi tambahan seperti	na hapa unaweza kuweka vigezo vya ziada vya programu kama vile	וכאן תוכל להגדיר פרמטרים נוספים של האפליקציה כגון	και εδώ μπορείτε να ορίσετε πρόσθετες παραμέτρους εφαρμογής όπως	en hier kunt u aanvullende applicatieparameters instellen, zoals	och här kan du ställa in ytterligare applikationsparametrar som	și aici poți seta parametri suplimentari ai aplicației, cum ar fi	és itt további alkalmazásparamétereket állíthatsz be, mint például	a zde můžete nastavit další parametry aplikace, jako je	a tu môžete nastaviť ďalšie parametre aplikácie, ako je	i ovde možete da podesite dodatne parametre aplikacije kao što su	и тук можеш да зададеш допълнителни параметри на приложението като
intro_text_28	periodic notifications on time, or after pressing the unlock button	okresowe powiadomienia na czas, czy po wciśnięciu przycisku odblokowania	regelmäßige Benachrichtigungen rechtzeitig oder nach Drücken der Entsperrtaste	notificaciones periódicas a tiempo, o después de presionar el botón de desbloqueo	notificações periódicas na hora certa ou após pressionar o botão de desbloqueio	notifications périodiques à temps ou après avoir appuyé sur le bouton de déverrouillage	notifiche periodiche in tempo o dopo aver premuto il pulsante di sblocco	zamanında veya kilit açma düğmesine bastıktan sonra periyodik bildirimler	pemberitahuan berkala tepat waktu, atau setelah menekan tombol buka kunci	การแจ้งเตือนตรงเวลาหรือหลังจากกดปุ่มปลดล็อค	時間通り、またはロック解除ボタンを押した後の定期的な通知	정시에 또는 잠금 해제 버튼을 누른 후 정기적인 알림	按时或按解锁按钮后定期通知	إشعارات دورية في الوقت المحدد، أو بعد الضغط على زر فتح القفل	периодические уведомления вовремя или после нажатия кнопки разблокировки	періодичні сповіщення вчасно або після натискання кнопки розблокування	thông báo định kỳ đúng giờ hoặc sau khi nhấn nút mở khóa	समय पर या अनलॉक बटन दबाने के बाद आवधिक सूचनाएं	সময়মতো পর্যায়ক্রমিক বিজ্ঞপ্তি, অথবা আনলক বোতাম টিপে	وقت پر، یا غیر مقفل بٹن دبانے کے بعد متواتر اطلاعات	pemberitahuan berkala mengikut masa, atau selepas menekan butang buka kunci	arifa za mara kwa mara kwa wakati, au baada ya kubonyeza kitufe cha kufungua	התראות תקופתיות בזמן, או לאחר לחיצה על כפתור הנעילה	περιοδικές ειδοποιήσεις στην ώρα τους, ή μετά το πάτημα του κουμπιού ξεκλειδώματος	periodieke meldingen op tijd, of na het indrukken van de ontgrendelknop	periodiska notifikationer i tid, eller efter att du tryckt på upplåsningsknappen	notificări periodice la timp sau după apăsarea butonului de deblocare	időszakos értesítések időben, vagy a feloldó gomb megnyomása után	pravidelná upozornění v čase nebo po stisknutí tlačítka odemknutí	pravidelné upozornenia v čase alebo po stlačení tlačidla odomknutia	periodična obaveštenja na vreme, ili nakon pritiska na dugme za otključavanje	периодични известия навреме или след натискане на бутона за отключване
intro_text_29	Here you have access to system battery parameters	Tutaj masz dostęp do systemowych parametrów baterii	Hier haben Sie Zugriff auf die Systembatterieparameter	Aquí tienes acceso a los parámetros de la batería del sistema.	Aqui você tem acesso aos parâmetros da bateria do sistema	Ici vous avez accès aux paramètres de la batterie du système	Qui hai accesso ai parametri della batteria del sistema	Burada sistem pil parametrelerine erişebilirsiniz	Di sini Anda memiliki akses ke parameter baterai sistem	ที่นี่คุณสามารถเข้าถึงพารามิเตอร์แบตเตอรี่ของระบบได้	ここでシステムバッテリーパラメータにアクセスできます	여기에서 시스템 배터리 매개변수에 액세스할 수 있습니다.	您可以在这里访问系统电池参数	هنا يمكنك الوصول إلى معلمات بطارية النظام	Здесь у вас есть доступ к параметрам батареи системы.	Тут ви маєте доступ до параметрів батареї системи	Tại đây bạn có quyền truy cập vào thông số pin hệ thống	यहां आपके पास सिस्टम बैटरी मापदंडों तक पहुंच है	এখানে আপনি সিস্টেম ব্যাটারি পরামিতি অ্যাক্সেস আছে	یہاں آپ کو سسٹم بیٹری کے پیرامیٹرز تک رسائی حاصل ہے۔	Di sini anda mempunyai akses kepada parameter bateri sistem	Hapa una ufikiaji wa vigezo vya betri ya mfumo	כאן יש לך גישה לפרמטרים של סוללת המערכת	Εδώ έχετε πρόσβαση στις παραμέτρους μπαταρίας του συστήματος	Hier heeft u toegang tot systeem batterijparameters	Här har du tillgång till systembatteriparametrar	Aici ai acces la parametrii bateriei sistemului	Itt hozzáférhetsz a rendszer akkumulátorparamétereihez	Zde máte přístup k parametrům baterie systému	Tu máte prístup k parametrom batérie systému	Ovde imate pristup parametrima baterije sistema	Тук имаш достъп до системните параметри на батерията
intro_text_30	and here you can check tips how to save energy and keep your battery in good health	a tutaj możesz poznać porady jak oszczędzać energię i utrzymać baterię w dobrym zdrowiu	Und hier finden Sie Tipps, wie Sie Energie sparen und Ihre Batterie gesund halten können	y aquí puedes consultar consejos sobre cómo ahorrar energía y mantener tu batería en buen estado	e aqui você confere dicas de como economizar energia e manter sua bateria em boas condições	et ici vous pouvez consulter des conseils pour économiser de l'énergie et garder votre batterie en bonne santé	e qui puoi consultare suggerimenti su come risparmiare energia e mantenere la batteria in buona salute	ve burada nasıl enerji tasarrufu yapacağınıza ve pilinizi nasıl sağlıklı tutacağınıza dair ipuçlarını kontrol edebilirsiniz	dan di sini Anda dapat memeriksa tips cara menghemat energi dan menjaga baterai Anda tetap sehat	และคุณสามารถดูเคล็ดลับในการประหยัดพลังงานและรักษาแบตเตอรี่ให้แข็งแรงได้ที่นี่	ここでは、エネルギーを節約し、バッテリーを良好な状態に保つためのヒントを確認できます。	여기에서 에너지를 절약하고 배터리를 건강하게 유지하는 방법에 대한 팁을 확인할 수 있습니다.	在这里您可以查看如何节省能源并保持电池健康的提示	وهنا يمكنك التحقق من النصائح حول كيفية توفير الطاقة والحفاظ على البطارية في حالة جيدة	и здесь вы можете ознакомиться с советами о том, как сэкономить энергию и сохранить аккумулятор в добром здравии.	і тут ви можете ознайомитися з порадами, як заощадити енергію та підтримувати акумулятор у хорошому стані	và tại đây bạn có thể xem các mẹo về cách tiết kiệm năng lượng và giữ cho pin luôn hoạt động tốt	और यहां आप ऊर्जा बचाने और अपनी बैटरी को अच्छी स्थिति में रखने के टिप्स देख सकते हैं	এবং এখানে আপনি কীভাবে শক্তি সঞ্চয় করবেন এবং আপনার ব্যাটারিকে সুস্বাস্থ্যের মধ্যে রাখবেন তার টিপস দেখতে পারেন৷	اور یہاں آپ توانائی بچانے اور اپنی بیٹری کو اچھی صحت میں رکھنے کے طریقے دیکھ سکتے ہیں۔	dan di sini anda boleh menyemak petua bagaimana untuk menjimatkan tenaga dan menjaga bateri anda dalam keadaan baik	na hapa unaweza kuangalia vidokezo vya jinsi ya kuokoa nishati na kuweka betri yako katika hali nzuri	וכאן תוכל לבדוק טיפים כיצד לחסוך באנרגיה ולשמור על הסוללה שלך במצב טוב	και εδώ μπορείτε να ελέγξετε συμβουλές για το πώς να εξοικονομήσετε ενέργεια και να διατηρήσετε την μπαταρία σας σε καλή κατάσταση	en hier kunt u tips bekijken over hoe u energie kunt besparen en uw batterij in goede staat kunt houden	och här kan du kontrollera tips om hur du sparar energi och håller batteriet i gott skick	și aici poți verifica sfaturi despre cum să economisești energie și să-ți menții bateria în stare bună	és itt tippeket találhatsz az energiatakarékossághoz és az akkumulátor jó állapotban tartásához	a zde si můžete prohlédnout tipy, jak šetřit energii a udržovat baterii v dobrém stavu	a tu si môžete pozrieť tipy, ako šetriť energiu a udržiavať batériu v dobrom stave	i ovde možete da proverite savete kako da uštedite energiju i održite bateriju u dobrom stanju	и тук можеш да провериш съвети как да пестиш енергия и да поддържаш батерията си в добро здраве
help_title_01	Application tasks	Zadania aplikacji	Anwendungsaufgaben	Tareas de la aplicación	Tarefas de aplicação	Tâches de l'application	Attività dell'applicazione	Uygulama görevleri	Tugas aplikasi	หน้าที่ของแอปพลิเคชัน	アプリケーション タスク	애플리케이션 작업	应用程序任务	مهام التطبيق	Задачи приложения	Завдання аплікації	Nhiệm vụ ứng dụng	एप्लिकेशन कार्य	আবেদন কাজ	درخواست کے کام	Tugas aplikasi	Kazi za programu	משימות האפליקציה	Εργασίες εφαρμογής	Applicatietaken	Applikationsuppgifter	Sarcini ale aplicației	Alkalmazás feladatai	Úkoly aplikace	Úlohy aplikácie	Zadaci aplikacije	Задачи на приложението
