app_lang_sign	en	pl	de	es	pt	fr	it	tr	id	th	ja	ko	zh
sound_fanfare	fanfare	fanfary	Fanfare	trompeteo	fanfarra	fanfare	fanfara	tantana	keriuhan di pawai	การประโคม	ファンファーレ	과시	大张旗鼓
sound_type_environment	environment	otoczenie	Umfeld	ambiente	ambiente	environnement	ambiente	çevre	lingkungan	สิ่งแวดล้อม	環境	환경	环境
sound_door	door	drzwi	Tür	puerta	porta	porte	porta	kapı	pintu	ประตู	ドア	문	门
sound_car	car	samochód	Auto	auto	carro	voiture	auto	araba	mobil	รถ	車	자동차	车
sound_thunder	thunder	burza	Donner	trueno	trovão	tonnerre	tuono	gök gürültüsü	guruh	ฟ้าร้อง	雷	우뢰	雷
sound_bell	bell	dzwonek	Glocke	campana	sino	cloche	campana	zil	bel	กระดิ่ง	ベル	종	铃铛
sound_lift	lift	winda	Aufzug	ascensor	elevador	ascenseur	ascensore	asansör	lift	ลิฟต์	エレベーター	엘리베이터	电梯
sound_lighter	lighter	zapalniczka	Feuerzeug	encendedor	isqueiro	briquet	accendino	çakmak	pemantik api	ไฟแช็ค	ライター	라이터	打火机
sound_ice	ice	lód	Eis	hielo	gelo	glace	ghiaccio	buz	es	น้ำแข็ง	氷	얼음	冰
sound_drop	drop	kropla	Tropfen	gota	gota	goutte	goccia	damla	tetes	หยด	滴	방울	滴
sound_clap	clap	klaskanie	Klatschen	aplaudir	aplauso	clappement	applauso	alkış	tepuk tangan	ปรบมือ	拍手	박수	鼓掌
sound_whistle	whistle	gwizdanie	Pfeife	silbido	apito	sifflet	fischio	düdük	peluit	นกหวีด	笛	휘파람	哨子
sound_type_technology	technology	technologia	Technologie	tecnología	tecnologia	technologie	tecnologia	teknoloji	teknologi	เทคโนโลยี	テクノロジー	기술	技术
sound_bonus	bonus	bonus	Bonus	prima	bônus	prime	bonus	bonus	bonus	โบนัส	ボーナス	보너스	奖金
sound_transformer	transformer	transformer	Transformator	transformador	transformador	transformateur	trasformatore	trafo	transformator	หม้อแปลงไฟฟ้า	変成器	변신 로봇	变压器
speech_hour	Hour	Godzina	Stunde	Hora	Hora	Heure	Ora	Saat	Jam	ชั่วโมง	時間	시간	小时
speech_date	Date	Data	Datum	Fecha	Data	Date	Data	Tarih	Tanggal	วันที่	日付	날짜	日期
speech_msg_nothing_to_say	I have nothing to say	Nie mam nic do powiedzenia	Ich habe nichts zu sagen	No tengo nada que decir	não tenho nada a dizer	je n\'ai rien à dire	Non ho niente da dire	söyleyecek hiçbir şeyim yok	Saya tidak punya apa-apa untuk dikatakan	ฉันไม่มีอะไรจะพูด	何も言うことはない	할 말이 없다	我无话可说了
speech_msg_app_locale_missing	The voice language is different than the application language - set your own notification messages	Język głosu jest inny niż język aplikacji - ustaw własne komunikaty powiadomień	Die Sprachsprache unterscheidet sich von der Anwendungssprache – legen Sie Ihre eigenen Benachrichtigungsnachrichten fest	El idioma de la voz es diferente al idioma de la aplicación: configure sus propios mensajes de notificación	O idioma da voz é diferente do idioma do aplicativo - defina suas próprias mensagens de notificação	La langue de la voix est différente de celle de l\'application - définissez vos propres messages de notification	La lingua della voce è diversa dalla lingua dell\'applicazione: imposta i tuoi messaggi di notifica	Ses dili uygulama dilinden farklı; kendi bildirim mesajlarınızı ayarlayın	Bahasa suara berbeda dengan bahasa aplikasi - atur pesan notifikasi Anda sendiri	ภาษาเสียงแตกต่างจากภาษาของแอปพลิเคชัน - ตั้งค่าข้อความแจ้งเตือนของคุณเอง	音声言語はアプリケーション言語とは異なります - 独自の通知メッセージを設定します	음성 언어가 애플리케이션 언어와 다릅니다. 알림 메시지를 직접 설정하세요.	语音语言与应用程序语言不同 - 设置您自己的通知消息
speech_msg_voice_not_installed	Voice not downloaded, no network connection	Język nie pobrany, brak połączenia sieciowego	Stimme nicht heruntergeladen, keine Netzwerkverbindung	Voz no descargada, sin conexión de red	Voz não baixada, sem conexão de rede	Voix non téléchargée, pas de connexion réseau	Voce non scaricata, nessuna connessione di rete	Ses indirilmedi, ağ bağlantısı yok	Suara tidak diunduh, tidak ada koneksi jaringan	ไม่ได้ดาวน์โหลดเสียง ไม่มีการเชื่อมต่อเครือข่าย	音声がダウンロードされていない、ネットワーク接続がない	음성이 다운로드되지 않았으며 네트워크에 연결되지 않았습니다.	语音未下载，没有网络连接
speech_params_modify	Modify	Zmień	Ändern	Modificar	Modificar	Modifier	Modificare	Değiştir	Memodifikasi	แก้ไข	修正する	수정하다	调整
speech_params_use_label	Settings	Ustawienia	Einstellungen	Ajustes	Configurações	Paramètres	Impostazioni	Ayarlar	Pengaturan	การตั้งค่า	設定	설정	设置
speech_params_use_description	Speech settings	Ustawienia mowy	Spracheinstellungen	Configuración de voz	Configurações de fala	Paramètres de parole	Impostazioni vocali	Konuşma ayarları	Pengaturan ucapan	การตั้งค่าคำพูด	音声設定	음성 설정	语音设置
speech_params_use_system	System - no change	Systemowe - bez zmian	System - keine Änderung	Sistema - sin cambios	Sistema - sem alteração	Système - aucun changement	Sistema: nessun cambiamento	Sistem - değişiklik yok	Sistem - tidak ada perubahan	ระบบ - ไม่มีการเปลี่ยนแปลง	システム - 変更なし	시스템 - 변화 없음	系统-无变化
speech_params_use_application	Application	Aplikacja	Anwendung	Solicitud	Aplicativo	Application	Applicazione	Başvuru	Aplikasi	แอปพลิเคชัน	応用	애플리케이션	应用
speech_params_use_custom	Enter custom	Podaj własne	Geben Sie „Benutzerdefiniert“ ein	Ingrese personalizado	Digite personalizado	Entrez personnalisé	Inserisci personalizzato	Özel girin	Masukkan kustom	ป้อนแบบกำหนดเอง	カスタムを入力してください	맞춤 입력	输入自定义
speech_params_voice_settings	Voice settings	Ustawienia głosowe	Spracheinstellungen	Configuraciones de voz	Configurações de voz	Paramètres vocaux	Impostazioni vocali	Ses ayarları	Pengaturan suara	การตั้งค่าเสียง	音声設定	음성 설정	语音设置
speech_params_clear_voice_settings	Restore settings	Przywróć ustawienia	Einstellungen zurücksetzen	Restaurar configuracion	Restaurar configurações	Restaurer les paramètres	Ripristina le impostazioni	Ayarları eski haline getir	Pulihkan pengaturan	คืนค่าการตั้งค่า	設定を復元	설정 복원	恢复设置
speech_params_voice_download_label	Download	Pobierz	Herunterladen	Descargar	Download	Télécharger	Scaricamento	İndirmek	Unduh	ดาวน์โหลด	ダウンロード	다운로드	下载
speech_params_voice_download_description	Voice download	Pobierz głosy	Sprachdownload	Descarga de voz	Baixar voz	Téléchargement vocal	Scaricamento vocale	Ses indirme	Pengunduhan suara	ดาวน์โหลดเสียง	音声ダウンロード	음성 다운로드	语音下载
speech_params_engine	Engine	Silnik	Motor	Motor	Motor	Moteur	Motore	Motor	Mesin	เครื่องยนต์	エンジン	엔진	引擎
speech_params_engine_description	Speech engine	Silnik mowy	Sprachmaschine	motor de voz	Motor de fala	Moteur vocal	Motore vocale	Konuşma motoru	Mesin ucapan	เครื่องมือพูด	音声エンジン	음성 엔진	语音引擎
speech_params_locale	Locale	Język	Gebietsschema	Lugar	Localidade	Lieu	Locale	Yerel ayar	Lokal	สถานที่	ロケール	장소	语言环境
speech_params_locale_description	Speech locale	Język mowy	Sprachgebietsschema	Lugar del habla	Local de fala	Localisation de la parole	Località vocale	Konuşma yerel ayarı	Lokal pidato	สถานที่พูด	音声ロケール	음성 로케일	语音语言环境
speech_params_voice	Voice	Głos	Stimme	Voz	Voz	Voix	Voce	Ses	Suara	เสียง	声	목소리	嗓音
speech_params_voice_description	Speech Voice	Głos mowy	Sprachstimme	voz del habla	Voz de fala	Voix vocale	Voce del discorso	Konuşma Sesi	Suara Pidato	เสียงพูด	スピーチ音声	음성 음성	语音语音
speech_params_rate	Speed	Szybkość	Geschwindigkeit	Velocidad	Velocidade	Vitesse	Velocità	Hız	Kecepatan	ความเร็ว	スピード	속도	速度
speech_params_rate_description	Speech speed	Szybkość mowy	Sprechgeschwindigkeit	velocidad del habla	Velocidade da fala	Vitesse de parole	Velocità del discorso	Konuşma hızı	Kecepatan bicara	ความเร็วในการพูด	話す速度	음성 속도	语速
speech_params_pitch	Pitch	Wysokość	Tonhöhe	Paso	Tom	Pas	Pece	Saha	Melempar	ขว้าง	ピッチ	정점	沥青
speech_params_pitch_description	Speech pitch	Wysokość mowy	Sprechhöhe	tono del discurso	Tom de fala	Emplacement du discours	Intonazione del discorso	Konuşma perdesi	Nada bicara	ระดับเสียงพูด	スピーチのピッチ	음성 피치	演讲音调
speech_enter_custom_text	Enter your own text to test voice	Wpisz własny tekst aby przetestować głos	Geben Sie Ihren eigenen Text ein, um die Stimme zu testen	Ingrese su propio texto para probar la voz	Digite seu próprio texto para testar a voz	Entrez votre propre texte pour tester la voix	Inserisci il tuo testo per testare la voce	Sesi test etmek için kendi metninizi girin	Masukkan teks Anda sendiri untuk menguji suara	ป้อนข้อความของคุณเองเพื่อทดสอบเสียง	独自のテキストを入力して音声をテストします	음성을 테스트하려면 자신만의 텍스트를 입력하세요.	输入您自己的文本来测试语音
speech_voice_test	Test voice	Przetestuj głos	Teststimme	prueba de voz	Teste de voz	Tester la voix	Prova la voce	Sesi test et	Uji suara	ทดสอบเสียง	テスト音声	테스트 음성	测试声音
speech_speak	Say text	Powiedz tekst	Sagen Sie Text	decir texto	Diga texto	Dites un texte	Di\' un messaggio	Metni söyle	Ucapkan teks	พูดข้อความ	テキストを言う	문자 메시지 말하기	说文字
speech_play	Play sound	Odtwórz dźwięk	Ton abspielen	Reproducir sonido	Tocar música	Jouer son	Riprodurre l\'audio	Sesi Oynat	Memainkan suara	เล่นเสียง	音を出す	소리 재생	播放声音
speech_recognize	Recognize speech	Rozpoznaj mowę	Sprache erkennen	reconocer el habla	Reconhecer fala	Reconnaître la parole	Riconoscere il discorso	Konuşmayı tanı	Kenali ucapan	รับรู้คำพูด	音声を認識する	음성 인식	识别语音
speech_voice	Voice	Głos	Stimme	Voz	Voz	Voix	Voce	Ses	Suara	เสียง	声	목소리	嗓音
speech_voice_male	Voice male	Głos mężczyzna	Stimme männlich	voz masculina	Voz masculina	Voix masculine	Voce maschile	Sesli erkek	Suara laki-laki	เสียงผู้ชาย	声は男性	목소리 남성	配音男
speech_voice_female	Voice female	Głos kobieta	Stimme weiblich	voz femenina	Voz feminina	Voix féminine	Voce femminile	Sesli kadın	Suara perempuan	เสียงผู้หญิง	女性の声	목소리 여성	配音女声
speech_test_hello	Hello	Cześć	Hallo	Hola	Olá	Bonjour	Ciao	Merhaba	Halo	สวัสดี	こんにちは	안녕하세요	你好
speech_test_good_morning	Good morning	Dzień dobry	Guten Morgen	Buen día	Bom dia	Bonjour	Buongiorno	Günaydın	Selamat pagi	สวัสดีตอนเช้า	おはよう	좋은 아침이에요	早上好
speech_test_how_are_you	How are you?	Jak się masz?	Wie geht es dir?	¿Cómo estás?	Como vai você?	Comment vas-tu?	Come stai?	Nasılsın?	Apa kabarmu?	คุณเป็นอย่างไร?	元気ですか？	어떻게 지내세요?	你好吗？
speech_test_thank_you	Thank you	Dziękuję	Danke	Gracias	Obrigado	Merci	Grazie	Teşekkür ederim	Terima kasih	ขอบคุณ	ありがとう	감사합니다	谢谢
speech_test_fine	Fine	Świetnie	Bußgeld	Bien	Multar	Bien	Bene	İyi	Bagus	ดี	大丈夫	괜찮은	美好的
speech_test_good_bye	Good bye	Do widzenia	Auf Wiedersehen	Adiós	Adeus	Au revoir	Arrivederci	Güle güle	Selamat tinggal	ลาก่อน	さようなら	안녕히 가세요	再见
speech_test_see_you	See you	Do zobaczenia	Wir sehen uns	Nos vemos	Vê você	À bientôt	Ci vediamo	Görüşürüz	Sampai jumpa	พบกันใหม่	またね	또 봐요	再见
speech_test_hear_you	Hear you	Do usłyszenia	Hören Sie	te escucho	Ouvir você	Vous entendre	Ti ascolto	seni duyuyorum	Mendengarmu	ได้ยินคุณ	聞いてください	당신의 말을 들어	听到你
speech_like_you_item00	I like you	Lubię cie	Ich mag dich	Me gustas	Gosto de você	Je t\'aime bien	mi piaci	Senden hoşlanıyorum	Aku menyukaimu	ฉันชอบคุณ	私はあなたが好きです	좋아해요	我喜欢你
speech_like_you_item01	I really like you	Naprawdę cie lubię	Ich mag dich wirklich	realmente me gustas	Eu gosto mesmo de você	je t\'aime vraiment	mi piaci davvero	senden gerçekten hoşlanıyorum	aku sangat menyukaimu	ฉันชอบคุณจริงๆ	私は本当にあなたが好きです	난 정말 당신을 좋아해요	我真的很喜欢你
speech_like_you_item02	I like you very much	Bardzo cie lubię	Ich mag dich sehr	me gustas mucho	eu gosto muito de você	je vous aime beaucoup	Mi piaci molto	seni çok seviyorum	aku sangat menyukaimu	ฉันชอบคุณมาก	私はあなたがとても好きです	나는 당신을 매우 좋아합니다	我很喜欢你
speech_like_you_item03	I said already I like you	Już mówiłam lubię cie	Ich habe schon gesagt, dass ich dich mag	Ya dije que me gustas	Eu já disse que gosto de você	Je l\'ai déjà dit, je t\'aime bien	Ho già detto che mi piaci	zaten senden hoşlandığımı söyledim	Aku sudah bilang aku menyukaimu	ฉันบอกไปแล้วว่าฉันชอบคุณ	君が好きだと言ったよ	난 이미 당신을 좋아한다고 말했어요	我已经说过我喜欢你了
speech_like_you_item04	I like you, I like you, I like you	Lubię cie, lubię cie, lubię cie	Ich mag dich, ich mag dich, ich mag dich	Me gustas, me gustas, me gustas	Eu gosto de você, eu gosto de você, eu gosto de você	Je t\'aime, je t\'aime, je t\'aime	Mi piaci, mi piaci, mi piaci	Senden hoşlanıyorum, senden hoşlanıyorum, senden hoşlanıyorum	Aku menyukaimu, aku menyukaimu, aku menyukaimu	ฉันชอบคุณ ฉันชอบคุณ ฉันชอบคุณ	好きです、好きです、好きです	나는 당신을 좋아합니다, 나는 당신을 좋아합니다, 나는 당신을 좋아합니다	我喜欢你，我喜欢你，我喜欢你
speech_like_you_item05	I said already many times that I like you	Już mówiłam wiele razy że cie lubię	Ich habe schon oft gesagt, dass ich dich mag	Ya dije muchas veces que me gustas	Eu já disse muitas vezes que gosto de você	Je l\'ai déjà dit plusieurs fois que je t\'aime bien	Ho già detto tante volte che mi piaci	Senden hoşlandığımı defalarca söyledim	Aku sudah berkali-kali mengatakan bahwa aku menyukaimu	ฉันพูดไปหลายครั้งแล้วว่าฉันชอบคุณ	もう何度も言いました、あなたが好きです	좋아한다고 벌써 몇번이나 말했어	我已经说过很多次我喜欢你了
face_nose	This is my nose	To jest mój nos	Das ist meine Nase	esta es mi nariz	Este é o meu nariz	C\'est mon nez	Questo è il mio naso	Bu benim burnum	Ini hidungku	นี่คือจมูกของฉัน	これは私の鼻です	이게 내 코야	这是我的鼻子
face_eye	This is my eye	To jest moje oko	Das ist mein Auge	este es mi ojo	Este é o meu olho	C\'est mon œil	Questo è il mio occhio	Bu benim gözüm	Ini mataku	นี่คือตาของฉัน	これは私の目です	이게 내 눈이야	这是我的眼睛
face_mouth	This is my mouth	To są moje usta	Das ist mein Mund	esta es mi boca	Esta é minha boca	C\'est ma bouche	Questa è la mia bocca	Bu benim ağzım	Ini mulutku	นี่คือปากของฉัน	これは私の口です	이게 내 입이야	这是我的嘴
face_hand	This is my hand	To jest moja ręka	Das ist meine Hand	Esta es mi mano	Esta é minha mão	C\'est ma main	Questa è la mia mano	Bu benim elim	Ini tanganku	นี่คือมือของฉัน	これは私の手です	이건 내 손이야	这是我的手
face_drink	This is juice	To jest napój	Das ist Saft	esto es jugo	Isso é suco	C\'est du jus	Questo è il succo	Bu meyve suyu	Ini jus	นี่คือน้ำผลไม้	これはジュースです	이건 주스예요	这是果汁
app_introduction_item00	Thank you for installing application, please listen to introduction	Dziękujemy za zainstalowanie aplikacji, prosimy o wysłuchanie wprowadzenia	Vielen Dank für die Installation der Anwendung. Bitte hören Sie sich die Einführung an	Gracias por instalar la aplicación, escuche la introducción.	Obrigado por instalar o aplicativo, ouça a introdução	Merci d\'avoir installé l\'application, veuillez écouter l\'introduction	Grazie per aver installato l\'applicazione, ascolta l\'introduzione	Uygulamayı yüklediğiniz için teşekkür ederiz, lütfen tanıtımı dinleyin	Terima kasih telah menginstal aplikasi, silakan dengarkan perkenalannya	ขอบคุณสำหรับการติดตั้งแอปพลิเคชัน โปรดฟังการแนะนำ	アプリケーションをインストールしていただきありがとうございます。紹介を聞いてください	애플리케이션을 설치해 주셔서 감사합니다. 소개를 들어주세요.	感谢您安装应用程序，请听介绍
app_introduction_item01	Application presents detailed battery parameters	Aplikacja prezentuje szczegółowe parametry baterii	Die Anwendung präsentiert detaillierte Batterieparameter	La aplicación presenta parámetros detallados de la batería.	Aplicativo apresenta parâmetros detalhados da bateria	L\'application présente les paramètres détaillés de la batterie	L\'applicazione presenta parametri dettagliati della batteria	Uygulama ayrıntılı pil parametrelerini sunar	Aplikasi menyajikan parameter baterai terperinci	แอปพลิเคชั่นแสดงพารามิเตอร์แบตเตอรี่โดยละเอียด	アプリケーションは詳細なバッテリーパラメータを表示します	애플리케이션은 자세한 배터리 매개변수를 제공합니다.	应用程序提供详细的电池参数
app_introduction_item02	and notifies with sound or voice about changes in	oraz powiadamia dźwiękiem lub głosem o zmianach	und benachrichtigt mit Ton oder Stimme über Änderungen in	y notifica con sonido o voz sobre cambios en	e notifica com som ou voz sobre mudanças em	et informe par le son ou la voix des changements dans	e avvisa con il suono o la voce sui cambiamenti in	değişiklikleri sesli veya sesli olarak bildirir.	dan memberi tahu dengan suara atau suara tentang perubahan	และแจ้งด้วยเสียงหรือเสียงเกี่ยวกับการเปลี่ยนแปลงภายใน	変化を音や音声でお知らせします。	변화를 소리나 음성으로 알려줍니다.	并通过声音或语音通知变化
app_introduction_item03	battery charge level	poziomu naładowania baterii	Ladezustand des Akkus	nivel de carga de la batería	nível de carga da bateria	niveau de charge de la batterie	livello di carica della batteria	pil şarj seviyesi	tingkat pengisian daya baterai	ระดับประจุแบตเตอรี่	バッテリー充電レベル	배터리 충전 수준	电池电量
app_introduction_item04	battery health	stanu zdrowia baterii	Batteriezustand	salud de la batería	saúde da bateria	santé de la batterie	salute della batteria	pil sağlığı	kesehatan baterai	สุขภาพแบตเตอรี่	バッテリーの状態	배터리 상태	电池健康
app_introduction_item05	connected charger	podłączonej ładowarce	angeschlossenes Ladegerät	cargador conectado	carregador conectado	chargeur connecté	caricabatterie collegato	bağlı şarj cihazı	pengisi daya yang terhubung	ที่ชาร์จที่เชื่อมต่ออยู่	接続された充電器	연결된 충전기	连接充电器
app_introduction_item11	Here you can modify sound settings	Tutaj można dostosować ustawienia dźwięku	Hier können Sie die Toneinstellungen ändern	Aquí puedes modificar la configuración de sonido.	Aqui você pode modificar as configurações de som	Ici vous pouvez modifier les paramètres sonores	Qui puoi modificare le impostazioni audio	Burada ses ayarlarını değiştirebilirsiniz	Di sini Anda dapat mengubah pengaturan suara	ที่นี่คุณสามารถแก้ไขการตั้งค่าเสียงได้	ここでサウンド設定を変更できます	여기에서 사운드 설정을 수정할 수 있습니다	在这里您可以修改声音设置
app_introduction_item12	turn off the sound	wyłączyć dźwięk	Schalten Sie den Ton aus	apaga el sonido	desligue o som	éteindre le son	disattivare l\'audio	Sesi kapatın	matikan suaranya	ปิดเสียง	音を消して	소리 꺼 줘	关掉声音
app_introduction_item13	or change various voice parameters such as type, speed or pitch	lub zmienić różne parametry głosu takie jak rodzaj, szybkość lub wysokość	oder verschiedene Stimmparameter wie Typ, Geschwindigkeit oder Tonhöhe ändern	o cambiar varios parámetros de voz como tipo, velocidad o tono	ou altere vários parâmetros de voz, como tipo, velocidade ou tom	ou modifier divers paramètres de voix tels que le type, la vitesse ou la hauteur	o modificare vari parametri della voce come tipo, velocità o intonazione	veya tür, hız veya perde gibi çeşitli ses parametrelerini değiştirin	atau mengubah berbagai parameter suara seperti jenis, kecepatan, atau nada	หรือเปลี่ยนพารามิเตอร์เสียงต่างๆ เช่น ประเภท ความเร็ว หรือระดับเสียง	または、種類、速度、ピッチなどのさまざまな音声パラメータを変更します	또는 유형, 속도 또는 피치와 같은 다양한 음성 매개변수를 변경합니다.	或更改各种语音参数，例如类型、速度或音调
app_introduction_item14	I can speak fast	mogę mówić szybko	Ich kann schnell sprechen	puedo hablar rápido	Eu posso falar rápido	Je peux parler vite	Posso parlare velocemente	hızlı konuşabiliyorum	Saya dapat berbicara dengan cepat	ฉันสามารถพูดได้เร็ว	私は速く話すことができます	나는 빨리 말할 수 있어요	我可以说得很快
app_introduction_item15	or I can speak slow	lub mogę mówić wolno	oder ich kann langsam sprechen	o puedo hablar lento	ou posso falar devagar	ou je peux parler lentement	oppure posso parlare lentamente	ya da yavaş konuşabilirim	atau saya dapat berbicara lambat	หรือฉันสามารถพูดช้าๆ	またはゆっくり話せます	아니면 천천히 말해도 돼요	或者我可以放慢语速
app_introduction_item16	You can download voices, to limit your network connection usage	Możesz pobrać głosy, aby ograniczyć korzystanie z sieci	Sie können Stimmen herunterladen, um die Nutzung Ihrer Netzwerkverbindung einzuschränken	Puede descargar voces para limitar el uso de su conexión de red.	Você pode baixar vozes para limitar o uso da conexão de rede	Vous pouvez télécharger des voix pour limiter l\'utilisation de votre connexion réseau	Puoi scaricare voci per limitare l\'utilizzo della connessione di rete	Ağ bağlantısı kullanımınızı sınırlamak için sesler indirebilirsiniz	Anda dapat mengunduh suara, untuk membatasi penggunaan koneksi jaringan Anda	คุณสามารถดาวน์โหลดเสียงเพื่อจำกัดการใช้งานการเชื่อมต่อเครือข่ายของคุณ	音声をダウンロードして、ネットワーク接続の使用を制限できます	음성을 다운로드하여 네트워크 연결 사용을 제한할 수 있습니다.	您可以下载语音，以限制您的网络连接使用
app_introduction_item21	You can customize the sounds and content of voice messages	Możesz dostosować dźwięki i treść komunikatów głosowych	Sie können die Töne und den Inhalt von Sprachnachrichten anpassen	Puedes personalizar los sonidos y el contenido de los mensajes de voz.	Você pode personalizar os sons e o conteúdo das mensagens de voz	Vous pouvez personnaliser les sons et le contenu des messages vocaux	È possibile personalizzare i suoni e il contenuto dei messaggi vocali	Sesli mesajların seslerini ve içeriğini özelleştirebilirsiniz	Anda dapat menyesuaikan suara dan isi pesan suara	คุณสามารถปรับแต่งเสียงและเนื้อหาของข้อความเสียงได้	音声メッセージのサウンドと内容をカスタマイズできます	음성 메시지의 소리와 내용을 사용자 정의할 수 있습니다.	您可以自定义语音消息的声音和内容
